"KEY","VALUE"
"Dřevo STIGA Aura Hybrid Carbon Cybershape","rychlost, kontrola"
"Dřevo Stiga Carbokev","rychlé dřevo, útočníci"
"Dřevo STIGA Carbonado 45","karbonové vrstvy, extrémní kontrola"
"Dřevo STIGA Celero Wood","STIGA Celero, technologie Diamond Touch"
"Dřevo STIGA Clipper","dřevo, rychlost"
"Dřevo STIGA Clipper 75","Clipper 75, stolní tenis"
"Dřevo STIGA Clipper CR","rychlost, údernost"
"Dřevo Stiga Clipper Cybershape","Dřevo, útočná klasika"
"Dřevo STIGA Clipper WRB","rychlost, údernost"
"Dřevo STIGA Cybershape Carbon","dřevo, karbon"
"Dřevo STIGA Cybershape Carbon CWT","Cybershape, kontrola"
"Dřevo STIGA Cybershape Carbon CWT Truls Edition","karbon, tvar"
"Dřevo STIGA Cybershape Wood CWT","hmotnost, energie"
"Dřevo STIGA Defensive Pro","Dřevo, kontrola"
"Dřevo STIGA Dynasty Carbon","Dynasty Carbon, útočné prkno"
"Dřevo STIGA Dynasty Carbon Xu Xin","Dynasty Carbon, útočné prkno"
"Dřevo STIGA Ebenholz NCT V","Dřevo STIGA, Útočné prkno"
"Dřevo STIGA Ebenholz NCT VII","Dřevo, útočníci"
"Dřevo STIGA Emerald VPS V","dřevo, útočné prkno"
"Dřevo STIGA Energy Wood V2 WRB","Dřevo STIGA Energy Wood V2, plastové míčky"
"Dřevo STIGA Eternity VPS V","útočné prkno, Diamond Touch"
"Dřevo STIGA Infinity VPS V","prkno, útočné"
"Dřevo STIGA Inspira CCF","Dřevo STIGA Inspira CCF, stůl tenisová prkno"
"Dřevo Stiga Inspira Hybrid Carbon","karbonové vrstvy, hybridní materiál"
"Dřevo STIGA Legacy Carbon","dřevěné dýhy, karbonové vrstvy"
"Dřevo STIGA Maplewood NCT V","Dřevo, Kontrola"
"Dřevo STIGA maxi Signature","prkno, dárek"
"Dřevo STIGA Offensive Classic","Dřevo, Ofenzivní"
"Dřevo STIGA Offensive Classic WRB","útočný hráči, úspěch"
"Dřevo Stiga Pure","útočná strategie, konzistentní výsledky"
"Dřevo Stiga Pure CWT","rychlost, kontrola"
"Dřevo Stiga Pure Cybershape","Dřevo, Útočná strategie"
"Dřevo STIGA Rosewood NCT VII","rychlost, kontrola"
"Dřevo Stiga Titanium 5.4 WRB","Titanium vrstvy, útočný hráči"
"Dřevo Stiga Wavy Ultra Fiber","rychlost, přesnost"
"Dřevo Stiga Wavy Ultra Fiber Cybershape","rychlost, ovládání"
"Dřevo TIBHAR Akkad","útočné prkno, topspin"
"Dřevo TIBHAR Allround Classic","dřevěná pálka, allroundové prkno"
"Dřevo TIBHAR Balsa Allround 50","Dřevo TIBHAR, Balsa Allround"
"Dřevo TIBHAR Balsa DEF 25","lehká pálka, obranné strategie"
"Dřevo TIBHAR Balsa Fibre OFF 60","Dřevo, prkno"
"Dřevo TIBHAR Balsa Fibretec 75","agresivní útočná hra, balsový střed"
"Dřevo TIBHAR Bernadette Szocs Signature 1","prkno, ping-pong"
"Dřevo TIBHAR CO-S-3","pasivní hra, kontrola míče"
"Dřevo TIBHAR Defense Plus","Dřevo TIBHAR, obranné prkno"
"Dřevo TIBHAR Drinkhall Allround Classic","rychlé allroundové prkno, mírně až středně pokročilí hráči"
"Dřevo TIBHAR Drinkhall Powerspin Carbon","Dřevo, prkno"
"Dřevo TIBHAR Dynamic J7-DJ7","Útočné dřevo, Darko Jorgič"
"Dřevo TIBHAR Dynamic JC-DJC","útočné prkno, karbonová vlákna"
"Dřevo TIBHAR Fortino Force","Dřevo Tibhar Fortino, Dyneema technologie"
"Dřevo TIBHAR Fortino PRO","prkno, karbon"
"Dřevo TIBHAR Fortino PRO DC Inside","Dřevo Fortino, útočná hra"
"Dřevo TIBHAR H-1-9","prkno, Hinoki"
"Dřevo TIBHAR H-3-9","Hinoki dřevo, útočné hráče"
"Dřevo TIBHAR IV-L","dřevo, prkno"
"Dřevo TIBHAR IV-L Balsa","prkno kontrola, dřevěné vrstvy"
"Dřevo TIBHAR IV-L Light Contact","dřevo, allroundové prkno"
"Dřevo TIBHAR IV-S","rychlé, spinově orientovaná útočná hra"
"Dřevo Tibhar Kratos","útočné prkno, karbonová vlákna"
"Dřevo TIBHAR Lebrun Alexis ALL+","Dřevo allroundové, vysoká kontrola"
"Dřevo TIBHAR Lebrun Alexis Krypto Carbon OFF","prkno, karbon"
"Dřevo TIBHAR Lebrun Alexis OFF","Dřevo TIBHAR Lebrun Alexis OFF, hybridní karbon"
"Dřevo TIBHAR Lebrun Felix ALL","Dřevo všestranné, Tibhar Lebrun"
"Dřevo TIBHAR Lebrun Felix Hyper Carbon OFF","rychlé útočné prkno, syntetické karbonové vlákno"
"Dřevo TIBHAR Lebrun Felix OFF-","rychlé prkno, všestranná hra"
"Dřevo TIBHAR Li Qian","Dřevo, obrana"
"Dřevo TIBHAR Libra ZAC Zodiac","kontrolovaná útočná hra, vyvážené prkno"
"Dřevo TIBHAR MK ALL","Dřevo TIBHAR MK ALL, prkno všestranná hra"
"Dřevo TIBHAR Rapid Carbon Light","karbonová vlákna, balsa"
"Dřevo TIBHAR Samsonov Alpha","kontrolovatelné útočné prkno, rychlý přechod do útoku"
"Dřevo TIBHAR Samsonov Carbon","prkno, karbonové vrstvy"
"Dřevo TIBHAR Samsonov Force Pro","Útočné prkno, Limba dýhy"
"Dřevo TIBHAR Samsonov Force Pro Black Edition","Samsonov Force Pro Black, stolní tenis"
"Dřevo TIBHAR Samsonov Premium Contact","útočné dřevo, minimální vibrace"
"Dřevo TIBHAR Samsonov Pure Wood","prkno, kontrola"
"Dřevo TIBHAR Samsonov Stratus Carbon","rychlé prkno, Kevlar karbon"
"Dřevo TIBHAR Stratus Powerdefense","tvrdé prkno, moderní obrana"
"Dřevo TIBHAR Stratus Powerwood","útočné údery, konkávní prkno"
"Dřevo TIBHAR Techno Power Contact","Dřevo stolního tenisu, kontrola a rychlost"
"Dřevo TIBHAR Triple Carbon","prkno, rychlost"
"Dřevo TIBHAR VS Unlimited","rychlé útočné prkno, spinová hra"
"Dřevo Andro TP Ligna Basalt Inner OFF","prkno vysoké kvality, čedičová vlákna"
"Dřevo Andro TP Ligna DEF","Dřevo TP Ligna, obranné prkno"
"Dřevo VICTAS Award Allround","údernější allround, dětská ruka"
"Dřevo VICTAS Award Allround Light","Dřevo VICTAS, Award Allround Light"
"Dřevo VICTAS Award Offensive","Dřevo útočné, vysoká kontrola"
"Dřevo VICTAS Award Offensive Light","Dětské prkno, Nízká váha"
"Dřevo VICTAS Balsa 2.5","dřevo, obrana"
"Dřevo VICTAS Balsa 3.5","obranářská pálka, nízká váha"
"Dřevo VICTAS Balsa 5.5","Dřevo VICTAS, balsa 5.5"
"Dřevo VICTAS Balsa 6.5","prkno, kontrola"
"Dřevo VICTAS Balsa 8.5","rychlé prkno, agresivní hra"
"Dřevo Victas Benedikt Duda AFC","prknoslova, pingpongprkno"
"Dřevo VICTAS Black Balsa 3.0","Dřevo, VICTAS"
"Dřevo VICTAS Black Balsa 5.0","vyvážené prkno, přesný úder"
"Dřevo VICTAS Black Balsa 7.0","Dřevo, úderná hra"
"Dřevo VICTAS Dyna Five","útočné prkno, kontrola úderu"
"Dřevo Victas Dyna Five Hard","Dřevo útočné, Japonská kvalita"
"Dřevo VICTAS Dyna Seven","Dřevo, útočná hra"
"Dřevo VICTAS Euro Feeling OFF-","prkno útočné, cypřišové držátko"
"Dřevo VICTAS Euro Power OFF","Dřevo, útočná hra"
"Dřevo VICTAS Fire Fall AC NEW DESIGN","rychlé prkno, moderní útočná hra"
"Dřevo VICTAS Fire Fall FC NEW DESIGN","dřevo, přesná útočná hra"
"Dřevo VICTAS Fire Fall HC NEW DESIGN","útočné prkno, agresívní topspin"
"Dřevo VICTAS Fire Fall LC NEW DESIGN","prkno, útočná hra"
"Dřevo VICTAS Fire Fall SC NEW DESIGN","prkno, moderní útočná hra"
"Dřevo VICTAS Fire Fall VC NEW DESIGN","karbonová technologie, útočné prkno"
"Dřevo Victas Gladias AR","útočné prkno, karbonové vlákno"
"Dřevo Victas Gladias EX","útočné prkno, karbonové vlákno"
"Dřevo Victas Gladias HA","útočné prkno, HA karbonové vlákno"
"Dřevo VICTAS Koji Matsushita","Dřevo Koji Matsushita, Defenzivní prkno"
"Dřevo VICTAS Koji Matsushita Defensive","Dřevo obranné, ruční výroba"
"Dřevo VICTAS Koji Matsushita Offensive","Dřevo Koji Matsushita, útočné prkno"
"Dřevo VICTAS Koji Matsushita Special","Dřevo, obrana"
"Dřevo VICTAS Koji Matsushita ZC","Dřevo Koji Matsushita, technologie Zexion"
"Dřevo VICTAS Koki Niwa","prkno útočné, kontraspin"
"Dřevo VICTAS Koki Niwa Wood","Dřevo VICTAS, útočné prkno"
"Dřevo VICTAS Koki Niwa ZC","Koki Niwa, útočné prkno"
"Dřevo Victas Yuto Maramatsu","obranářská pálka, japonská kvalita"
"Dřevo VICTAS ZX-GEAR IN","Dřevo, útočné prkno"
"Dřevo VICTAS ZX-GEAR OUT","Dřevo, útočné prkno"
"Dřevo Xiom 36.5 Alxi","prkno XIOM, arylátové vlákno"
"Dřevo XIOM Aigis","obrana, útok"
"Dřevo XIOM Allround S","Dřevo, allroundové prkno"
"Dřevo XIOM Axelo","prkno, útok"
"Dřevo XIOM Diva","prkno, celodřevěná konstrukce"
"Dřevo XIOM Extreme S","Dřevo XIOM, kontrola pingpong"
"Dřevo XIOM Fuga","útočné prkno, spinová hra"
"Dřevo Xiom Hayabusa ARX","Útočné prkno, aramid karbon"
"Dřevo Xiom Hayabusa HX PRO","silné prkno, zachycení míče"
"Dřevo XIOM Hayabusa OFF PRO","útočná hra, prvotřídní dýhy"
"Dřevo Xiom Hayabusa ZL PRO","útočné prkno, profesionální hra"
"Dřevo Xiom Hayabusa ZLX","prkno, vysoký katapult efekt"
"Dřevo Xiom Hugo Tmxi PRO","Dřevo XIOM, útočné prkno"
"Dřevo XIOM Ignito","Dřevo XIOM Ignito, útočné prkno"
"Dřevo Xiom LSS ALX Lite","Dřevo XIOM, útočné prkno"
"Dřevo XIOM Offensive S","útočné dřevo, kontrolovaná hra"
"Dřevo Xiom Paltida","prkno, pokročilé hráče"
"Dřevo XIOM Solo","měkké prkno, útočné dřevo"
"Dřevo XIOM Stradivarius","spin, dynamika"
"Dřevo XIOM Strato","rychlé dřevo, útočný úder"
"DVD Dr. Neubauer Langnoppen-technik","Dlouhé pipsy, Technika stolního tenisu"
"DVD Contra Die Aufschläge Der Profis","servis, DVD"
"medaile ENEBE Iron","stříbrná medaile, stolní tenis"
"podlaha ENEBE Y14155","podlaha, sportovní povrch"
"podlaha Enlio Enlio Y14155","sportovní podlaha, neklouzavá povrchová úprava"
"Rozhodovací Mince Nittaku","rozhodčí, mince"
"síť Gewo Ersatzkettchen ""leiter""","náhradní řetízek, GEWO síť"
"síť Gewo Ersatznetz Universal","náhradní síťka, univerzální černá"
"počítadlo Gewo GEWO Zählgerät Compact Time Out","náhradní čísla, ukazatel skóre"
"počitadlo Gewo GEWO Zählgerät Prime","náhradní čísla, GEWO počítadlo"
"příslušenství Donic Feststellschraube + Teller Pro Donic Stress-netz","upínací šroub, síť Donic"
"počitadlo Exacto Exacto TIME OUT","časomíra, elektronické počítadlo"
"Potah Nittaku Express","Expresní útočná kratší nopka, stolní tenis"
"tréninkový systém FastPong Fast Pong System","interaktivní trénink, vizuální zpětná vazba"
"tréninkové zařízení Contra Flip-paddle","Flip-Paddle trénink, stolní tenis"
"tréninkové zařízení Contra Flip-paddle Set","Flip-Pádlo, tréninková pomůcka"
"tréninkové zařízení Contra Flippomat","Flippomat, tréninková technologie"
"Dřevo Nittaku Flyatt Carbon OFF","lehká pálka, karbonový povrch"
"Potah Nittaku Flyatt Evo","novinka, rychlost"
"Potah Nittaku Flyatt Hard","rychlý potah, vysoká kontrola"
"Pálka Nittaku Flyatt Kombi","Flyatt Kombi nabídka, Flyatt Carbon dřevo"
"Potah Nittaku Flyatt Soft","měkký povrch, vysoká kontrola"
"Potah Nittaku Flyatt Spin","Flyatt Spin, otočení"
"míček Friendship 40+ Three Star","míč, kvalita"
"potah Friendship 729 Aurora","rychlost, topspinová hra"
"potah Friendship 729 Aurora Max","levná guma, euro/japonský styl"
"potah Friendship 729 Focus III Snipe","přátelství, topspin"
"potah Friendship 729 Geospin","přelepovací efekt, útočná hra"
"houba Friendship 729 Orange Sponge","pálkařská houba, stolní tenis"
"potah Friendship 729 Origin","lepkavý povrch, extrémní rotace"
"potah Friendship 729 Super FX - Oranžová Houba","lepivý potah, trénink hráčů"
"potah Friendship 729-08","potah, technologie Sensor"
"potah Friendship 729-08 ES","přilnavá guma, vysoká rotace"
"potah Friendship 729-2","přátelství, univerzální hra"
"potah Friendship 729-2 Sensor New","rychlý potah, topspinový útok"
"potah Friendship 837 Mystery III","kontrola, rotace"
"potah Friendship Battle II Province","útočná guma, lepkavý povrch"
"dřevo Friendship C-2 FL","profesionální prkno, vysoká kvalita"
"potah Friendship Dr.evil OX","potah, stolní tenis"
"potah Friendship Dr.evil Supersoft","sendvič, vysoká kontrola"
"houba Friendship HRS Cream Sponge","krémová houba, defenzivní potah"
"dřevo Friendship L-3","rychlost, středně tvrdé dřevo"
"potah Friendship Legend 105","sendvič, potah"
"potah Friendship RITC 563-1","půlpouti, polosendviče"
"potah Friendship RITC 729 Cream","přilnavý, defenzivní"
"potah Friendship RITC 729 Topsheet","přátelství, potahy"
"potah Friendship RITC 755","obranná hra, kvalitní tráva"
"potah Friendship RITC 802","útočný sendvič, topspinová hra"
"potah Friendship RITC 802-1","útočný sendvič, bloky u stolu"
"potah Friendship RITC 804","Antitopspinový potah, kontrola útoků"
"Potah Friendship 729 FX Super Soft","přátelství, kontrola"
"Potah Friendship 729 Super FX Lightening","přátelství, stolní tenis"
"Potah Friendship Friendship 729 Super FX","přátelství, stolní tenis"
"Potah Friendship 729 Super FX","přátelství, stolní tenis"
"Potah Friendship 729-08","přilnavost, topspin"
"Potah Friendship 729-5","přátelství 729-5, útočný potah"
"Potah Friendship Friendship 755 Mystery III","Přátelství potah 755, dlouhé vroubky"
"Potah Friendship Friendship 802 Mystery III","přímý úder, elastický houba"
"Potah Friendship Belag 802 Mystery III","Přátelství potah 802, útočný pálkař"
"Potah Friendship Friendship 802-40 Mystery III","přelepka stolní tenis, útočná hra"
"Potah Friendship Friendship 802-40 Soft","přátelství 802-40, krátké vroubky"
"Potah Friendship Friendship Belag 802-40 Soft","Přátelství potah, ofenzivní nopy"
"Potah Friendship Belag 802-40 Soft","soft 802-40, krátké vroubky"
"Potah Friendship Friendship Belag 837 Mystery III","přátelství, stolní tenis"
"Potah Friendship R.i.t.c. 729 Dr. Evil","přátelství, obrana"
"Potah Friendship R.i.t.c. 729 Geospin","Přátelství, Geospin"
"Potah Friendship R.i.t.c. 729 Higher","přilnavý povrch, útočná hra"
"Potah Friendship R.i.t.c. 729-2","přátelství, elastický povrch"
"Potah Friendship R.i.t.c. 799","Přátelství Belag kontrola, střední rychlost"
"Potah Friendship R.i.t.c. 804","přátelství, defenzivní hra"
"Potah Friendship Friendship RITC 2000","přátelství, stolní tenis"
"Potah Friendship RITC 2000","přátelství, rychlost"
"Potah Friendship RITC 563-1","přátelské potahy, střední tvrdost"
"Potah Friendship RITC 729 Tack Speed","přilnavost, kontrola"
"Potah Friendship RITC 755","přátelství, dlouhé čínské nopky"
"Potah Friendship RITC 802","Přímý útok, čínské potahy"
"Potah Friendship RITC 837","Dlouhé trny, Řízení rotace"
"Potah Friendship RITC 729 Geospin Tacky","přilnavý povrch, kontrola míče"
"potah Friendship 729 FX","klasický potah, všestranná hra"
"potah Friendship 729 FX Lightening","lehký potah, defenzivní hra"
"potah Friendship 729 FX Super Soft","přátelství, super měkký"
"potah Friendship Geospin","rychlý potah, GeoSpin"
"potah Friendship Friendship 729-2 New","lepkavý povrch, topspinový útok"
"potah Friendship Geo Spin Tacky","pomalý potah, lepivá guma"
"potah Friendship 729 - 837","obranná hra, kvalitní tráva"
"potah Friendship 729 Faster","potah, útok"
"potah Friendship 729 Higher","rychlost, kontrola"
"pohár FS Pohár 23701-03","pohár vítěze, zlatý štítek"
"pohár FS Pohár 23704-06","pohár, cena"
"pohár FS Fs-pohár 23710-12","pohár vítěze, imitace mramoru"
"pohár FS Fs-pohár 23713-15","pohár, cena pro vítěze"
"pohár FS Fs-pohár 23716-18","pohár vítěze, štítek na podstavec"
"pohár FS Pohár 23719-21","pohár vítězství, štítek na podstavec"
"pohár FS Pohár 23722-24","Pohár, Cena vítěze"
"pohár FS Pohár 23725-27","pohár vítězství, štítek na podstavec"
"pohár FS Pohár 23728-30","Pohár vítěze, štítek na podstavec"
"pohár FS Pohár 23801-03","Pohár vítěze, Zlatý štítek"
"pohár FS Pohár 23804-06","pohár vítězství, mramorový podstavec"
"pohár FS Pohár 23810-12","pohár vítězství, mramorový podstavec"
"pohár FS Pohár 23816-18","pohár cena, mramorový podstavec"
"pohár FS Pohár 23819-21","pohár cena, mramorový podstavec"
"pohár FS Pohár 23822-24","pohár, podstavec"
"pohár FS Pohár 23825-27","trofej, mramorový podstavec"
"štítek FS Štítek Na Pohár/medaili","zlatý štítek, poháry medaile"
"Potah Nittaku Genextion V2C","NITTAKU GENEXTION V2C, optimální přilnavost"
"dřevo Gewo Balsa Carbon 375","prkno, všestrannost"
"dřevo Gewo Balsa Carbon 775","rychlost, kontrola"
"dřevo Gewo In-force Pbo-pc OFF","rychlost, kontrola"
"stůl Gewo GEWO SC 25 Premium","pingpongový stůl, síťka na stolní tenis"
"ponožky Gewo Kurzsocke Short Flex II","krátká ponožka, tréninkové ponožky"
"GEWO 3er Set Kurzsocke Short Flex II  39-41","krátké ponožky, tréninkové ponožky"
"ponožky Gewo Short Flex II","ponožky, trénink"
"Ponožky Gewo Short Flex II","ponožky, trénink"
"Sada Ponožek Gewo 3ks Short Flex II","ponožky, sportovní"
"ponožky Gewo 4er Set Kurzsocke Short Flex II","ponožky, sportovní"
"GEWO 4er Set Kurzsocke Short Flex II  39-41","ponožky, sportovní"
"ponožky Gewo Step Flex III","ponožky, pingpong"
"ponožky Gewo GEWO Step Flex III","GEWO Step Flex 3, ponožky stolní tenis"
"Sada Ponožek Gewo 4ks Short Flex II","ponožky, tréninky"
"Sada Gewo 4x Ponožky Step Flex Iii""","GEWO Step Flex, stolní tenis"
"kryt Gewo Abdeckhaube Outdoor","povlak na stůl, ochranný kryt venkovní"
"kryt Gewo Abdeckhaube Outdoor Premium","plachta na stolní tenis, venkovní kryt na stůl"
"pouzdro Gewo GEWO Alu Doppel Case","pouzdro na stolní tenis, hliníkový kufřík"
"příslušenství Gewo Andruckrolle","přítlačný váleček, montáž potahu"
"příslušenství Gewo Andruckrolle / Ballbox","přítlačný válec, box na míčky"
"oblečení Gewo Anzug Florenz","tréninková souprava, černá/modrá"
"GEWO Anzug Tarent TS18-1 blau/navy S","sportovní souprava, lehký materiál"
"sportovní oblečení Gewo Anzug Tarent Ts18-1","sportovní souprava, funkční materiál"
"sportovní oblek Gewo Anzug Tarent Ts18-1","sportovní souprava, polyester"
"kalhoty Gewo GEWO Anzughose Basic Logo I","tréninkové kalhoty, stolní tenis"
"kalhoty Gewo Anzughose Basic Logo I","tréninkové kalhoty, stolní tenis"
"kalhoty Gewo Anzughose Basic Logo II","sportovní kalhoty, funkční oblečení"
"kalhoty Gewo GEWO Anzughose Basic Logo II","tréninkové kalhoty, funkční oblečení"
"kalhoty Gewo Anzughose Gandia","pánské kalhoty, sportovní oblečení"
"kalhoty Gewo GEWO Anzughose Gandia","sportovní kalhoty, streetwear"
"kalhoty Gewo Anzughose Lifestyle Basic","joggingové kalhoty, polyester"
"kalhoty Gewo GEWO Anzughose Lifestyle Logo I","tréninkové kalhoty, pohodlné kalhoty"
"kalhoty Gewo Anzughose Lifestyle Logo I","tréninkové kalhoty, sportovní oblečení"
"kalhoty Gewo Anzughose Lifestyle Logo II","tréninkové kalhoty, logo životního stylu"
"kalhoty Gewo GEWO Anzughose Lifestyle Logo II","tréninkové kalhoty, lifestyle logo"
"kalhoty Gewo Mazara Ts18-4","kalhoty oblek, pohodlný střih"
"kalhoty Gewo Anzughose Salo","tepláky, polyester"
"kalhoty Gewo Anzughose Topas","sportovní kalhoty, polyester"
"tepláková souprava Gewo Vigo","pánské teplákové kalhoty, tréninkový oblek"
"tréninkové kalhoty Gewo Vigo","tréninková souprava, přechodové oblečení"
"tréninkový oblek Gewo GEWO Anzughose Vigo","pánská tepláková souprava, sportovní oblečení"
"kalhoty Gewo Vigo","tréninková souprava, sportovní oblečení"
"tréninkový oblek Gewo Vigo","tréninková souprava, stolní tenis"
"bunda Gewo Anzugjacke Merkur","bunda na trénink, sportovní bunda"
"tréninková bunda Gewo Anzugjacke Monto","tréninková bunda, funkční materiál"
"bunda Gewo Anzugjacke Monto","cvičební bunda, polyester"
"bunda Gewo Anzugjacke Pit","bunda, tepláková souprava"
"bunda Gewo Anzugjacke Salo","tréninková bunda, polyesterová bunda"
"bunda Gewo Anzugjacke Storm","bunda, trénink"
"bunda Gewo Anzugjacke Tarent Ts18-1","sportovní bunda, polyesterový materiál"
"bunda Gewo Tarent Ts18-1","sportovní bunda, polyester"
"bunda Gewo Anzugjacke Topas","sportovní bunda, prodyšný materiál"
"bunda Gewo Anzugjacke Tramin","sportovní bunda, stylová oblečení"
"tréninková bunda Gewo Vigo","tréninková bunda, přechodová bunda"
"kalhoty Gewo Anzugshose Basic","tepláky, polyester"
"kalhoty Gewo Anzugshose Basic Nine Iron XL","kalhoty na trénink, polyesterové kalhoty"
"Batoh Gewo Nexxus","batoh, stolní tenis"
"Batoh Gewo Spy","batoh, stolní tenis"
"Míčky Gewo AWR Outdoor 40+ 6ks","míčky na stolní tenis, venkovní použití"
"míček Gewo Ball AWR Outdoor 40+","GEWO míčky, venkovní stolní tenis"
"Koš na Míčky Gewo","košík na míčky, stolní tenis"
"Náhradní Guma ke Krabici na Míčky Gewo","náhradní guma, klec na míčky"
"Koš na Míčky Gewo s 6x AWR Outdoor Míčky","míčky na stolní tenis, voděodolné míčky"
"Sběrač Míčků Gewo","sběrač míčků, tréninkový pomocník"
"Sběrač Míčků Gewo Pick-up","sběrač míčků, tréninkový nástroj"
"míček Gewo Double Star SLP 40+","GEWO míčky, tréninkový míček"
"míček Gewo Double Star Slp40+","tréninkový míč, poly materiál"
"Míčky Gewo Double Star Slp40+","tréninkový míč, bezesný plast"
"Míčky Gewo Select Pro 40+ *** 3ks","míčky GEWO, soutěžní míček"
"Míčky Gewo Ball Select Pro 40+ ***","plastový míček, turnajový míček"
"Míčky Gewo Select Pro 40+ *** 6ks","míček, soutěžní"
"Míčky Gewo Select Pro 40+ *** 72ks","míčky, soutěžní"
"Míčky Gewo Sports-mix 12ks","míčky, mix barev"
"míček Gewo Ball Sports-mix 12er Bunt","míčkové sporty, mix míčků"
"míček Gewo Ball Training Club 40+ **","tréninkové míčky, stolní tenis"
"míček Gewo GEWO Ball Training Club 40+ **","tréninkové míčky, plastové ABS"
"míček Gewo GEWO Ball Training Club 40+**","tréninkový míček, plastový míček"
"Míčky Gewo Training Club 40+** 72ks","míček, trénink"
"míček Gewo GEWO Ball Ultra SLP 40+ ***","míček na stolní tenis, bezšvový plast"
"míček Gewo Ball Ultra SLP 40+ ***","míček, stolní tenis"
"Míčky Gewo Ultra SLP 40+ *** 3ks","míčky, GEWO"
"Míčky Gewo Ultra SLP 40+ *** 6ks","míčky, kvalita"
"sběrač míčků Gewo Ballaufsammler (ohne Deckel)","sběrač míčků, box na míčky"
"sběrač míčků Gewo Ballaufsammler","sběrač míčků, teleskopická tyč"
"míček Gewo Ball Select Pro 40+ ***","míček, plastový"
"míček Gewo GEWO AWR Outdoor 40+","GEWO AWR Outdoor, míčky na stolní tenis"
"sběrná síť Gewo Ballfangnetz Robot Net Pro Training","tréninková pomůcka, sběr míčků"
"koš na míčky Gewo Ballkorb","držák na míčky, efektivní trénink"
"příslušenství Gewo Ballkorb Ersatz Gummipuffer","náhradní gumový nárazník, stůl na stolní tenis"
"sběrač míčků Gewo Ballsammelnetz Pick-up","sběratel míčků, tréninkové nástroje"
"Sada Gewo Ball-set Je 1x Training Club 40+** + Select Pro 40+*** 72er","tréninkové míče, soutěžní míče"
"Sada Gewo GEWO Ball-set Ultra SLP 40+*** + Double Star 40+","míček, trénink"
"Pálka Gewo CS Energy Carbon","rychlost, kontrola"
"Pálka Gewo CS Energy Carbon Pro","GEWO raketa CS Energy Carbon Pro, stolní tenis"
"Pálka Gewo CS Energy Control","GEWO pálka CS Energy Control, stolní tenis"
"Pálka Gewo CS Energy Power","potah GEWO, stolní tenis"
"Pálka Gewo Fun","Pálka, rekreační hráči"
"Pálka Gewo Fun-starter","pálka, začátečníci"
"Pálka Gewo PS Blast Carbon","pálka, stolní tenis"
"Pálka Gewo PS Blast Carbon Pro","spin, rychlost"
"Pálka Gewo PS Blast Control","kontrola, rotace"
"Pálka Gewo PS Blast Junior","dětská pálka, stolní tenis"
"Pálka Gewo PS Blast Power","rychlý pingpongový pálkař, konkávní grip"
"Pálka Gewo Rave Game","pálka, stolní tenis"
"Pálka Gewo Rave Junior","pálka stolního tenisu, GEWO Rave Junior"
"Pálka Gewo Rave Speed","rychlost, kontrola"
"Sada Pálky Gewo Rave Speed","pálka na stolní tenis, GEWO RAVE SPEED"
"Pálka Gewo Standard Pro","pálka stolní tenis, ITTF schválené potahy"
"Pálka Gewo: Dřevo Zoom Pro Light s Neoflexxund Return Pro 1,9/1,6","pálka GEWO, Zoom Pro Light"
"Pálka Gewo: Dřevo Zoom Pro Light s Neoflexxund Return Pro 1,9/1,6 ","pálka GEWO, Zoom Pro Light"
"Pálka Gewo: Dřevo Force ARC s Hype EL Pro 47.5 + Neoflexx Eft48","pálka, stolní tenis"
"Pálka Gewo: Dřevo Allround Classic s Potahy Elaxxon 50.0 + 45.0","pálka, stolní tenis"
"Pálka Gewo: Dřevo Allround Classic s Mega Flex Control + Hallmark Devil-anti","pálka, stolní tenis"
"Pálka Gewo: Dřevo Aruna All+ s Proton Neo 325 + Neoflexx Eft48","pálka, stolní tenis"
"Pálka Gewo: Dřevo Balsa Carbon 375 s Neoflexx Eft40 + Mega Flex Control","pálka, kontrola"
"Pálka Gewo: Dřevo Force ARC s Hype EL Pro 42.5 + Target Airtec","univerzální hráč, GEWO pálka"
"Pálka Gewo: Dřevo Force ARC s Potahy Inventus XT Pro 52.5 + 50.0","pálka, stolní tenis"
"Pálka Gewo: Dřevo Force ARC s Nexxus EL Pro53 Supsel + Nexxus EL Pro50 Supsel","pálka, rotace"
"Pálka Gewo: Dřevo Hybrid Carbon A/speed s Mega Spin Control + Target Airtec","dřevo, kontrola"
"Pálka Gewo: Dřevo In-force ARC s Nexxus EL Pro48 + Nexxus EL Pro","pálka, rotace"
"Pálka Gewo: Dřevo In-force Pbo-pc s Nexxus EL Pro45 Supsel + Proton Neo 450","rotace, topspin"
"Pálka Gewo: Dřevo Talent ALL s Mega Flex Control","dřevěná pálka, kontrolní potah"
"Pálka Gewo: Dřevo Velox Alpha s Neoflexx Eft40 + Hallmark Tactics LP","obranná pálka, spodní rotace"
"Pálka Gewo: Dřevo Zoom Pro s Hallmark Mega Spin Control + Mega Flex Control","pálka, zoom pro"
"Pálka Gewo: Dřevo Zoom Pro s Potahy Inventus XT Pro 47.5 + Elaxxon 45.0","Útočná hra, variabilní rotace"
"Pálka Gewo: Dřevo Zoom Pro s Target Airtec FX + Return Pro","pálka, útočná"
"Pálka Gewo Champ","GEWO raketa Champ, pingpongová pálka"
"Pálka Gewo Smash","pálka, herní vlastnosti"
"Potah Gewo Codexx EF Pro 54","tvrdá houba, výbušný spin"
"Potah Gewo GEWO Codexx EF Pro 54","ofenzivní hráč, maximální rotace"
"Potah Gewo Codexx EL Pro 52","potah, spin"
"Potah Gewo Codexx EL Pro 52 (elastic Power)","rychlé pohyby, explozivní hra"
