"KEY","VALUE"
"Tibhar - MK carbon","karbonová struktura, kontrola úderů"
"Tibhar - MK7","útočné prkno, zpětná vazba"
"Tibhar - Mundo","Tibhar Mundo polokošile, polyester mikrovlákno"
"Tibhar - Mundo Cotton","polokošile, 100% bavlna"
"Tibhar - Mundo Lady","Tibhar oblečení, sportovní polokošile"
"Tibhar - Mundo sukně","Tibhar sukně, pohodlný pas"
"Tibhar - Mundo šortky","Tibhar Mundo šortky, sportovní šortky"
"Tibhar - Mundo TS","Souprava, Nadčasový design"
"Tibhar - nátepník Evolution","Tibhar, nátepník"
"Tibhar - Nimbus","rychlý, točivý"
"Tibhar - Nimbus ALL","rychlost, kontrola"
"Tibhar - Nimbus OFF","rychlost, kontrola"
"Tibhar - Nimbus Soft","potah měkký, útočníci"
"Tibhar - Nimbus sound","točivost, kontrola"
"Tibhar - ohrádka 233 cm fullcover","zelená ohrádka, nylonová tkanina"
"Tibhar - ohrádka 233 cm fullcover - Logo STOTEN","ohrádka, Tibhar"
"Tibhar - Orbit polokošile","sportovní polokošile, prodyšná polyester"
"Tibhar - Osmium bunda","sportovní bunda, funkční materiál"
"Tibhar - Osmium France tričko","tričko, sportovní oblečení"
"Tibhar - Osmium kalhoty","kalhoty, funkční vlákno"
"Tibhar - Osmium polokošile","polokošile na sport, pohodlná tkanina"
"Tibhar - Osmium sukně","sukně sportovní, pohodlný funkční materiál"
"Tibhar - Osmium šortky","Tibhar Osmium šortky, sportovní kraťasy"
"Tibhar - Osmium tričko dámské","dámské tričko, funkční oblečení"
"TIBHAR - peněženka Casual","peněženka, každodenní použití"
"TIBHAR - počítadlo Counter","počítadlo bodů, klubové použití"
"TIBHAR - Počítadlo Time Out","Počítadlo bodů, Počítadlo setů"
"Tibhar - POINT Alum double kufřík","kufřík na pálky, ochrana pálky"
"Tibhar - POINT Alum kufřík","pálka, kufřík"
"Tibhar - Polo shirt MEN","pánské tričko, polyesterové tričko"
"TIBHAR - potítko L 2021","potítko, froté materiál"
"TIBHAR - potítko S 2021","potítko, froté materiál"
"Tibhar - potítko Tibhar velikost L","potítko, froté materiál"
"Tibhar - potítko Tibhar velikost S","potítko, froté materiál"
"Tibhar - Pouzdro na míčky Grid (3)","pouzdro na míčky, ochrana míčků"
"Tibhar - pouzdro na míčky Sydney","pouzdro, míčky"
"TIBHAR - pouzdro Sydney Single","pouzdro na pálku, ochrana proti poškození"
"TIBHAR - pouzdro T Round","pouzdro na pálku, barevné kombinace"
"TIBHAR - pouzdro T Round s kapsou na míčky","pouzdro na pálku, barevné kombinace"
"TIBHAR - pouzdro T Single","pouzdro, moderní design"
"TIBHAR - Power Clue 100 ml","lepidlo, vodní báze"
"TIBHAR - Power Clue 250 ml","lepidlo, rychlé zasychání"
"TIBHAR - Power Wipes - Dezinfekční čisticí ubrousky","dezinfekční ubrousky, stolní tenis"
"Tibhar - Powergrip Edition","rotace, rychlost"
"Tibhar - Presto","prodyšný nylon, moderní design"
"Tibhar - PRO tričko","Tibhar tričko, lehký polyester"
"Tibhar - Protect pouzdro","pouzdro na pálky, obousměrný zip"
"TIBHAR - Pulse šortky","šortky, polyesterové mikrovlákno"
"Tibhar - Pulse towel","ručník, froté"
"TIBHAR - Pulse tričko","tričko, mikrovlákno"
"Tibhar - Quantum","dynamický potah, katapult efekt"
"Tibhar - Quantum S","křivka letu, katapult efekt"
"Tibhar - Quantum X Pro","rychlost, rotace"
"Tibhar - QUANTUM X PRO BLUE","rychlost, rotace"
"Tibhar - QUANTUM X PRO Green","rychlost, rotace"
"Tibhar - QUANTUM X PRO PINK","rychlost, rotace"
"Tibhar - QUANTUM X PRO PURPLE","rychlost, rotace"
"Tibhar - Quantum X pro soft","potah, kontrola"
"TIBHAR - Quantum X PRO SOFT BLUE","potah, stabilita"
"TIBHAR - Quantum X PRO SOFT PINK","růžová houba, stolní tenis"
"TIBHAR - Race Cotton polokošile","polokošile, egyptská bavlna"
"TIBHAR - Rapid Carbon Light","lehký karbon, vysoká kontrola"
"Tibhar - Relief Alpha","ručník, froté"
"Tibhar - Relief Beta","froté ručník, klasický ručník"
"Tibhar - Retro","lehká obuv, stolní tenis"
"Tibhar - ROBOPRO GENIUS","Tibhar robot, jednoduchá obsluha"
"Tibhar - ROBOPRO JUNIOR","robot na stolní tenis, dálkové ovládání"
"TIBHAR - ROBOPRO Master","robotická atmosféra, trénink úderů"
"Tibhar - ROBOPRO PLUS","robot na stolní tenis, dálkový ovladač"
"Tibhar - ROOKIE BLUE EDITION","hobby hráči, výuka technik"
"Tibhar - ROOKIE DRINKHALL","Tibhar pálka, hobby hráči"
"Tibhar - ROOKIE JORGIC","Tibhar - ROOKIE JORGIC, pingpongová pálka"
"TIBHAR - RUBBER CLEANER GRIP 125 ml","čistič, přilnavost"
"TIBHAR - RUBBER CLEANER GRIP 250 ml","čistič, přilnavost"
"Tibhar - Ručník T","Tibhar ručník, bavlněný ručník"
"Tibhar - Samsonov Alpha","útočné prkno, střední rychlost"
"Tibhar - Samsonov Carbon","rychlost, útočníci"
"TIBHAR - Samsonov Force Pro","útočné prkno, dýhy Limba"
"TIBHAR - Samsonov Premium Contact","útočné dřevo, minimální vibrace"
"Tibhar - Samsonov Premium Junior","dřevěná pálka, děti hráči"
"TIBHAR - Samsonov Pure Wood","allroundové prkno, vysoká kontrola"
"Tibhar - Samsonov Stratus Carbon","dřevo, carbon"
"Tibhar - Scala polokošile","sportovní polokošile, mikrovlákno"
"Tibhar - Scream polokošile","polokošile, mikrovlákno"
"TIBHAR - Shang Kun Hybrid AC","hybridní, stabilita"
"Tibhar - Shanghai bag","sportovní taška, polyester"
"TIBHAR - Shanghai batoh","batoh, multifunkční"
"Tibhar - Shirt 2011WTTC","tričko, trénink"
"Tibhar - Shirt Game cot","bavlněné tričko, elastické tričko"
"Tibhar - Shirt Trial cotton","tričko, bavlna"
"Tibhar - Short Beach","příjemný materiál, klasický střih"
"Tibhar - Sinus","rychlá hra, profesionální hráči"
"Tibhar - Sinus alpha","rychlost, kontrola"
"Tibhar - Sinus sound","rychlost, kontrola"
"Tibhar - Skirt Lady","sukně, šortky"
"Tibhar - Sky zimní bunda","zimní bunda, stolní tenis"
"TIBHAR - Smash 28 R","Smash 28 R, soutěžní stůl"
"TIBHAR - Smash 28 SC “W”","Soutěžní stůl, vozíčkářský stůl"
"TIBHAR - SMASH ALL","univerzální, lehké dřevo"
"Tibhar - Smash Pro","Tričko bez límečku, Tibhar logo"
"Tibhar - Smash pro ručník","lehký ručník, savá bavlna"
"TIBHAR - Smash síťka","síťka na stolní tenis, ITTF schválená síťka"
"Tibhar - Smash tričko","tričko, polyester"
"Tibhar - Soft Edge páska","ochranná páska, hrana dřeva"
"Tibhar - SOL","Tibhar tričko, mikrovlákno"
"TIBHAR - souprava Club","TIBHAR, souprava"
"Tibhar - Space polokošile","polokošile, polyester"
"TIBHAR - Spectra","Polokošile, mikrovlákno"
"Tibhar - Speedy Soft D.TecS","nebezpečný potah, rušivé bloky"
"TIBHAR - Speedy Soft D.Tecs XD","rychlá útočná hra, citlivý blok"
"Tibhar - Speedy soft XD","rychlá hra, krátké vroubky"
"TIBHAR - Spider Neo","sálové boty, technologie Energy Convertor"
"Tibhar - Stolek pro rozhodčí","rozhodčí stolek, skládací rám"
"TIBHAR - Stratus Powerdefense","prkno, moderní obrana"
"TIBHAR - Stratus Powerwood","útočné údery, všestranné prkno"
"TIBHAR - Stripe","polokošile, prvek"
"Tibhar - Stripe šortky","stolní tenis šortky, lehký funkční materiál"
"Tibhar - Super Defense 40","obranný potah, kontrola"
"Tibhar - Super Defense 40 soft","defenzivní potah, stolní tenis"
"Tibhar - Super Grip Tape","super-adhezní, nano-tech grip"
"Tibhar - Super Sonic Prolight","pingpongová obuv, bezpečnostní chrániče"
"Tibhar - Sydney dvojité pouzdro","pouzdro na pálky, kapsa na přední části"
"Tibhar - Sydney taška malá","sportovní taška, odnímatelný prostor"
"Tibhar - Sydney taška velká","sportovní taška, prostorný úložný prostor"
"Tibhar - šortky LC","mikrovlákno, elastický pas"
"Tibhar - taška Century malá","sportovní taška, moderní design"
"TIBHAR - taška Manila","taška sportovní, úložný prostor"
"Tibhar - tašky Deluxe","taška DeLuxe, prostorná kapsa"
"Tibhar - Tech II","kvalitní ponožky, dynamický pohyb"
"Tibhar - Techno Power Allround","pomalejší prkno, herní charakteristiky"
"Tibhar - Terra souprava","sada z mikrovlákna, sportovní souprava"
"Tibhar - Terra tričko","polokošile, týmové oblečení"
"Tibhar - Thunder polokošile","lehké tričko, módní design"
"Tibhar - TIBHARlette pantofle","pantofle, stélou"
"Tibhar - TOALETNÍ TAŠKA","toaletní taška, úložný prostor"
"Tibhar - Trend","polokošile, mikrovlákno"
"Tibhar - Trend TS","tepláková souprava, sportovní oblečení"
"Tibhar - Trial Poly shirt","mikrovlákno, polokošile"
"Tibhar - tričko MEN","triko, polyester"
"TIBHAR - Triple Carbon","karbonové vrstvy, rychlost hraní"
"TIBHAR - TripleX","polokošile, límeček"
"Tibhar - Váleček na potahy","Tibhar, vyrovnávání"
"Tibhar - VariSpin D.TecS","aktivní allrounder, dynamika"
"Tibhar - Vibe","polokošile, mikrovlákno"
"Tibhar - Volcano+","všestranný potah, středně měkká houba"
"TIBHAR - VS Top 90 ml lepidlo","rychleschnoucí lepidlo, houbičky pro aplikaci"
"Tibhar - VS Unlimited","rychlé dřevo, útočný topspin"
"Tibhar - World tričko","mikrovlákno, polokošile"
"Tibhar - XXX Orange Edition","rotace, ovládání"
"Tibhar - XXX SZOCS","Tibhar pálka, pokročilá technika"
"Tibhar - zimní čepice","zimní čepice, hřejivá čepice"
"Tibhar - ZODIAC LIBRA ZAC","kontrola, útočná hra"
"Tibhar 40+ SYNTT*** - 3 kusy","míčky, plastové"
"TIBHAR Alukoffer mit Tragegriff silber","pouzdro, pálka"
"TIBHAR Andruckrolle","pogumovaná váleček, elastická guma"
"TIBHAR Anzughose Etna schwarz L","tepláky, elastické kalhoty"
"TIBHAR Anzughose Etna schwarz M","sportovní kalhoty, elastický materiál"
"TIBHAR Anzughose Etna schwarz XL","trekingové kalhoty, elastický pás"
"TIBHAR Anzughose Etna schwarz XXL","sportovní kalhoty, funkční materiál"
"TIBHAR Anzughose Etna schwarz XXXL","kalhoty, pohodlí"
"TIBHAR Anzughose Etna schwarz XXXXL","pánské kalhoty, elastický pas"
"TIBHAR Anzughose Jura schwarz M","tepláky, sportovní kalhoty"
"TIBHAR Anzughose Jura schwarz XXL","tepláky, sportovní oblečení"
"TIBHAR Anzughose Jura schwarz XXS","Tepláky, Elastický pás"
"TIBHAR Anzughose Jura schwarz XXXL","tepláky, sportovní oblečení"
"TIBHAR Anzughose Jura schwarz XXXXL","funkční materiál, elastický pas"
"TIBHAR Anzughose Mundo marine M","TIBHAR kalhoty, polyester"
"TIBHAR Anzughose Mundo marine S","TIBHAR kalhoty Mundo, funkční materiál"
"TIBHAR Anzughose Mundo marine XL","teplákové kalhoty, polyester"
"TIBHAR Anzughose Mundo marine XS","sportovní kalhoty, polyesterové kalhoty"
"TIBHAR Anzughose Mundo marine XXL","funkční materiál, elastický pas"
"TIBHAR Anzughose Mundo marine XXS","funkční materiál, elastický pas"
"TIBHAR Anzughose Mundo marine XXXL","tepláky, polyester"
"TIBHAR Anzughose Mundo schwarz L","TIBHAR kalhoty Mundo, kalhoty černé"
"TIBHAR Anzughose Mundo schwarz S","sportovní kalhoty, polyesterový materiál"
"TIBHAR Anzughose Mundo schwarz XL","sportovní kalhoty, černé polyesterové"
"TIBHAR Anzughose Mundo schwarz XS","sportovní kalhoty, pohodlný materiál"
"TIBHAR Anzughose Mundo schwarz XXXL","pánské sportovní kalhoty, černé kalhoty XXXL"
"TIBHAR Anzughose Osmium schwarz M","kalhoty OSMIUM, pohodlný materiál"
"TIBHAR Anzughose Osmium schwarz S","černé sportovní kalhoty, pohodlný polyesterový materiál"
"TIBHAR Anzughose Osmium schwarz XL","kalhoty, polyester"
"TIBHAR Anzughose Osmium schwarz XS","kalhoty pohodlí, elastický pas"
"TIBHAR Anzughose Osmium schwarz XXL","tepláky, černá XXL"
"TIBHAR Anzughose Osmium schwarz XXS","funkční kalhoty, pohodlný materiál"
"TIBHAR Anzughose Osmium schwarz XXXL","pohodlné kalhoty, sportovní kalhoty"
"TIBHAR Anzughose Osmium schwarz XXXXL","kalhoty elastické, pohodlný materiál"
"TIBHAR Anzughose Terra marine L","tréninková tepláková souprava, funkční materiály"
"TIBHAR Anzughose Terra marine M","sportovní kalhoty, pohodlný střih"
"TIBHAR Anzughose Terra marine S","tréninková souprava, pohodlné oblečení"
"TIBHAR Anzughose Terra marine XL","tréninková souprava, funkční materiál"
"TIBHAR Anzughose Terra marine XS","tréninková souprava, funkční materiál"
"TIBHAR Anzughose Terra marine XXL","tréninková tepláková souprava, pohodlné sportovní oblečení"
"TIBHAR Anzughose Terra marine XXS","tréninková tepláková souprava, pohodlné nošení"
"TIBHAR Anzughose Terra marine XXXL","tréninková souprava, sportovní oblečení"
"TIBHAR Anzughose Terra marine XXXXL","tréninková souprava, pohodlné oblečení"
"TIBHAR Anzughose Terra schwarz L","tréninková tepláková souprava, funkční materiály"
"TIBHAR Anzughose Terra schwarz M","tréninkové kalhoty, sportovní tepláky"
"TIBHAR Anzughose Terra schwarz S","tréninková souprava, sportovní kalhoty"
"TIBHAR Anzughose Terra schwarz XL","tréninková souprava, funkční materiál"
"TIBHAR Anzughose Terra schwarz XS","tréninkové kalhoty, komfortní střih"
"TIBHAR Anzughose Terra schwarz XXL","tréninková souprava, funkční materiály"
"TIBHAR Anzughose Terra schwarz XXS","tréninková souprava, funkční materiál"
"TIBHAR Anzughose Terra schwarz XXXL","tréninkové kalhoty, pohodlné oblečení"
"TIBHAR Anzughose Terra schwarz XXXXL","tepláková souprava, funkční materiály"
"TIBHAR Anzughose Trend schwarz M","TIBHAR kalhoty, pohodlné oblečení"
"TIBHAR Anzughose Trend schwarz S","TIBHAR kalhoty, funkční materiál"
"TIBHAR Anzughose Trend schwarz XL","tepláky černé, elastický pas"
"TIBHAR Anzughose Trend schwarz XS","TIBHAR kalhoty, sportovní kalhoty"
"TIBHAR Anzughose Trend schwarz XXL","TIBHAR kalhoty, sportovní kalhoty"
"TIBHAR Anzughose Trend schwarz XXS","tepláky, elastické"
"TIBHAR Anzughose Trend schwarz XXXL","kalhoty sportovní, elastický pás"
"TIBHAR Anzughose Trend schwarz XXXXL","TIBHAR tepláky, pohodlné sportovní kalhoty"
"TIBHAR Anzugjacke Etna schwarz L","sportovní bunda, černá bunda"
"TIBHAR Anzugjacke Etna schwarz M","bunda, lehký materiál"
"TIBHAR Anzugjacke Etna schwarz S","lehké funkční materiály, elegantní design"
"TIBHAR Anzugjacke Etna schwarz XL","lehká bunda, elegantní design"
"TIBHAR Anzugjacke Etna schwarz XS","lehká funkční bunda, elegantní design"
"TIBHAR Anzugjacke Etna schwarz XXL","bunda, funkční materiál"
"TIBHAR Anzugjacke Etna schwarz XXS","bunda Etna, pohodlná bunda"
"TIBHAR Anzugjacke Etna schwarz XXXL","mikina, funkční materiál"
"TIBHAR Anzugjacke Etna schwarz XXXXL","bunda, funkční materiál"
"TIBHAR Anzugjacke Jura schwarz/blau L","TIBHAR mikina, sportovní bunda"
"TIBHAR Anzugjacke Jura schwarz/blau M","sportovní bunda, funkční materiál"
"TIBHAR Anzugjacke Jura schwarz/blau XL","pánská bunda, sportovní oblečení"
"TIBHAR Anzugjacke Jura schwarz/blau XXL","funkční materiál, komfort"
"TIBHAR Anzugjacke Jura schwarz/blau XXS","TIBHAR bunda, funkční materiál"
"TIBHAR Anzugjacke Jura schwarz/blau XXXXL","TIBHAR bunda, sportovní bunda"
"TIBHAR Anzugjacke Jura schwarz/rot L","TIBHAR bunda, funkční materiál"
"TIBHAR Anzugjacke Jura schwarz/rot M","sportovní bunda, pohodlný materiál"
"TIBHAR Anzugjacke Jura schwarz/rot S","bunda TIBHAR, funkční materiál"
"TIBHAR Anzugjacke Jura schwarz/rot XL","bunda funkční materiál, kapsy na zip"
"TIBHAR Anzugjacke Jura schwarz/rot XS","TIBHAR bunda, funkční materiál"
"TIBHAR Anzugjacke Jura schwarz/rot XXL","bunda funkční, sportovní bunda"
"TIBHAR Anzugjacke Jura schwarz/rot XXS","funkční bunda, pohodlný materiál"
"TIBHAR Anzugjacke Jura schwarz/rot XXXXL","Bunda sportovní funkční, Pohodlné nošení"
"TIBHAR Anzugjacke Mundo marine/petrol L","TIBHAR sportovní bunda, polyesterová bunda"
"TIBHAR Anzugjacke Mundo marine/petrol M","funkční materiál, jednoduchý design"
"TIBHAR Anzugjacke Mundo marine/petrol XL","bunda Mundo, sportovní bunda"
"TIBHAR Anzugjacke Mundo marine/petrol XS","bunda sportovní, polyesterová bunda"
"TIBHAR Anzugjacke Mundo marine/petrol XXL","sportovní bunda, polyesterová bunda"
"TIBHAR Anzugjacke Mundo marine/petrol XXS","funkční materiál, polyester"
"TIBHAR Anzugjacke Mundo marine/petrol XXXL","mikina Mundo, sportovní bunda"
"TIBHAR Anzugjacke Mundo marine/petrol XXXXL","funkční materiál, polyester"
"TIBHAR Anzugjacke Mundo marine/petrol XXXXXL","sportovní bunda, polyester"
"TIBHAR Anzugjacke Mundo marine/rot L","funkční materiál, polyesterová bunda"
"TIBHAR Anzugjacke Mundo marine/rot M","sportovní bunda, funkční materiál"
"TIBHAR Anzugjacke Mundo marine/rot XL","sportovní bunda, polyesterová bunda"
"TIBHAR Anzugjacke Mundo marine/rot XS","funkční materiál, polyester"
"TIBHAR Anzugjacke Mundo marine/rot XXL","bunda, polyester"
"TIBHAR Anzugjacke Mundo marine/rot XXS","TIBHAR sportovní bunda, sportovní oblečení"
"TIBHAR Anzugjacke Mundo marine/rot XXXL","buněčný materiál, sportovní bunda"
"TIBHAR Anzugjacke Mundo marine/rot XXXXL","bunda sportovní, polyester bunda"
"TIBHAR Anzugjacke Mundo marine/rot XXXXXL","bunda, polyester"
"TIBHAR Anzugjacke Osmium  blau L","softshell bunda, sportovní bunda"
"TIBHAR Anzugjacke Osmium  blau M","bunda OSMIUM, sportovní bunda"
"TIBHAR Anzugjacke Osmium  blau S","sportovní bunda, pohodlný materiál"
"TIBHAR Anzugjacke Osmium  blau XL","funkční bunda, polyesterová bunda"
"TIBHAR Anzugjacke Osmium  blau XS","sportovní bunda, funkční materiál"
"TIBHAR Anzugjacke Osmium  blau XXL","bunda Osmium, sportovní bunda"
"TIBHAR Anzugjacke Osmium  blau XXS","bunda funkční, sportovní design"
"TIBHAR Anzugjacke Osmium  blau XXXL","sportovní bunda, pohodlný materiál"
"TIBHAR Anzugjacke Osmium  blau XXXXL","sportovní bunda, pohodlný materiál"
"TIBHAR Anzugjacke Osmium  rot L","bunda, polyester"
"TIBHAR Anzugjacke Osmium  rot M","bunda osmium, sportovní bunda"
"TIBHAR Anzugjacke Osmium  rot S","funkční materiál, polyester"
"TIBHAR Anzugjacke Osmium  rot XL","Bunda Osmium, Funkční materiál"
"TIBHAR Anzugjacke Osmium  rot XS","funkční materiál, polyesterový kabátek"
"TIBHAR Anzugjacke Osmium  rot XXL","softshell bunda, sportovní bunda"
"TIBHAR Anzugjacke Osmium  rot XXS","funkční materiál, polyesterová bunda"
"TIBHAR Anzugjacke Osmium  rot XXXL","bunda sportovní, pohodlný materiál"
"TIBHAR Anzugjacke Osmium  rot XXXXL","bunda osmium, sportovní bunda"
"TIBHAR Anzugjacke Osmium  schwarz L","Oblek Osmium, Pánská bunda"
"TIBHAR Anzugjacke Osmium  schwarz M","bunda Osmium, funkční materiál"
"TIBHAR Anzugjacke Osmium  schwarz S","bunda pohodlí, polyesterová bunda"
"TIBHAR Anzugjacke Osmium  schwarz XL","sportovní bunda, polyesterová bunda"
"TIBHAR Anzugjacke Osmium  schwarz XS","bunda OSMIUM, sportovní bunda"
"TIBHAR Anzugjacke Osmium  schwarz XXL","měkký materiál, vysoký komfort"
"TIBHAR Anzugjacke Osmium  schwarz XXS","bunda, polyester"
"TIBHAR Anzugjacke Osmium  schwarz XXXL","bunda, pohodlný materiál"
"TIBHAR Anzugjacke Osmium  schwarz XXXXL","sportovní bunda, polyester"
"TIBHAR Anzugjacke Prestige blau XS","termomikrovlákno, pohodlná bunda"
"TIBHAR Anzugjacke Prestige rot XS","mikrovlákno, polyester"
"TIBHAR Anzugjacke Terra marine L","tréninková souprava, sportovní bunda"
"TIBHAR Anzugjacke Terra marine M","tréninková bunda, pohodlné oblečení"
"TIBHAR Anzugjacke Terra marine S","Tréninková souprava, Figurální střih"
"TIBHAR Anzugjacke Terra marine XL","tréninková souprava, pohodlné oblečení"
"TIBHAR Anzugjacke Terra marine XS","tréninková bunda, sportovní oblečení"
"TIBHAR Anzugjacke Terra marine XXL","tréninková bunda, sportovní souprava"
"TIBHAR Anzugjacke Terra marine XXS","tréninková souprava, sportovní bunda"
"TIBHAR Anzugjacke Terra marine XXXL","sportovní oblečení, pohodlná bunda"
"TIBHAR Anzugjacke Terra marine XXXXL","tréninková bunda, sportovní souprava"
"TIBHAR Anzugjacke Terra schwarz L","tréninková souprava, sportovní oblečení"
"TIBHAR Anzugjacke Terra schwarz S","tréninková souprava, pohodlné nošení"
"TIBHAR Anzugjacke Terra schwarz XL","tréninková bunda, sportovní oblečení"
"TIBHAR Anzugjacke Terra schwarz XS","sportovní bunda, tréninková souprava"
"TIBHAR Anzugjacke Terra schwarz XXL","tréninková bunda, sportovní oblečení"
"TIBHAR Anzugjacke Terra schwarz XXS","tréninková bunda, sportovní souprava"
"TIBHAR Anzugjacke Terra schwarz XXXL","tréninková souprava, pánská bunda"
"TIBHAR Anzugjacke Terra schwarz XXXXL","tréninková bunda, pohodlné materiály"
"TIBHAR Anzugjacke Trend schwarz/blau L","pánská sportovní bunda, funkční materiál"
"TIBHAR Anzugjacke Trend schwarz/blau M","TIBHAR bunda, sportovní oblečení"
"TIBHAR Anzugjacke Trend schwarz/blau S","bunda černá modrá, materiál polyester"
"TIBHAR Anzugjacke Trend schwarz/blau XL","týmová bunda, sportovní oblečení"
"TIBHAR Anzugjacke Trend schwarz/blau XS","bunda černá modrá, sportovní bunda"
"TIBHAR Anzugjacke Trend schwarz/blau XXL","sportovní bunda, funkční materiál"
"TIBHAR Anzugjacke Trend schwarz/blau XXXL","sportovní bunda, pohodlné nošení"
"TIBHAR Anzugjacke Trend schwarz/rot L","sportovní bunda, funkční materiál"
"TIBHAR Anzugjacke Trend schwarz/rot M","pánská sportovní bunda, pohodlný funkční materiál"
"TIBHAR Anzugjacke Trend schwarz/rot S","sportovní bunda, polyester"
"TIBHAR Anzugjacke Trend schwarz/rot XL","sportovní bunda, polyester"
"TIBHAR Anzugjacke Trend schwarz/rot XS","sportovní bunda, pohodlný materiál"
"TIBHAR Anzugjacke Trend schwarz/rot XXL","funkční bunda, pohodlný materiál"
"TIBHAR Anzugjacke Trend schwarz/rot XXXL","sportovní bunda, funkční materiál"
"TIBHAR Anzugjacke Trend schwarz/rot XXXXL","TIBHAR bunda, sportovní oblečení"
"TIBHAR Ball * 40+ SYNTT NG 72er weiß","tréninkové míčky, bezceluloidový míček"
"TIBHAR Ball *** 40+ SYNTT NG 3er Pack orange","pingpongové míčky, turnajové míčky"
"TIBHAR Ball *** 40+ SYNTT NG 72er orange","TIBHAR míčky, stolní tenis míčky"
"TIBHAR Ball ***40+ SL (nahtlos) 3er weiß","míč na stolní tenis, soutěžní míček"
"TIBHAR Ball ***40+ SL (nahtlos) 72er weiß","TIBHAR míčky, stolní tenis"
"TIBHAR Ball Basic 40+ SL 72er weiß","tréninkový míček, bezešvý plast"
"TIBHAR Ball Basic 40+ SYNTT NG 72er orange","pingpongový míček, bezceluloidový"
"TIBHAR Ballauffangnetz 2019","sítko na chytání míčků, trénink podání"
"TIBHAR Ballbox Logo","TIBHAR Ballbox, Uložení míčků"
"TIBHAR Belag 5Q rot 1,7 mm","TIBHAR potah, topspin hra"
"TIBHAR Belag 5Q schwarz 1,7 mm","TIBHAR Belag 5Q, středně tvrdá houbička"
"TIBHAR Belag Aurus Prime rot 1,7 mm","útočný potah, technologie SSP"
"TIBHAR Belag Aurus Prime rot 1,9 mm","offenzivní technika, katapultovaný útočný potah"
"TIBHAR Belag Aurus Prime rot 2,1 mm","TIBHAR Belag Aurus Prime, útočný potah"
"TIBHAR Belag Aurus Prime rot 2,3 mm","offenzivní technika, rychlostní potah"
"TIBHAR Belag Aurus Prime schwarz 1,7 mm","TIBHAR potah, útočný gumový potah"
"TIBHAR Belag Aurus Prime schwarz 1,9 mm","TIBHAR potah, útočný stolní tenis"
"TIBHAR Belag Aurus Prime schwarz 2,1 mm","ofenzivní technici, spinově orientovaný"
"TIBHAR Belag Aurus Prime schwarz 2,3 mm","útočný potah, rychlost a rotace"
"TIBHAR Belag Aurus rot 1,7 mm","energický, topspin"
"TIBHAR Belag Aurus rot 1,9 mm","TIBHAR Aurus, stolní tenis"
"TIBHAR Belag Aurus rot 2,1 mm","Aurus, stolní tenis"
"TIBHAR Belag Aurus Select rot 1,7 mm","TIBHAR potah, technologie SSP"
"TIBHAR Belag Aurus Select rot 1,9 mm","TIBHAR Belag Aurus Select, všestranný hráč"
"TIBHAR Belag Aurus Select rot 2,1 mm","TIBHAR potah, Aurus Select"
"TIBHAR Belag Aurus Select rot 2,3 mm","TIBHAR potah, technologie SSP"
"TIBHAR Belag Aurus Select schwarz 1,7 mm","TIBHAR Aurus, všestranný povrch"
"TIBHAR Belag Aurus Select schwarz 1,9 mm","Alleskönner, technologie"
"TIBHAR Belag Aurus Select schwarz 2,1 mm","TIBHAR Belag Aurus Select, technologie SSP"
"TIBHAR Belag Aurus Select schwarz 2,3 mm","TIBHAR potah, univerzální všestrannost"
"TIBHAR Belag Aurus schwarz 1,7 mm","TIBHAR Aurus, rakety na stolní tenis"
"TIBHAR Belag Aurus schwarz 1,9 mm","TIBHAR Aurus, stolní tenis"
"TIBHAR Belag Aurus schwarz 2,1 mm","energie, spin"
"TIBHAR Belag Aurus Soft rot 1,7 mm","měkký potah, topspinová kontrola"
"TIBHAR Belag Aurus Soft rot 1,9 mm","Aurus Soft, kontrola topspinů"
"TIBHAR Belag Aurus Soft rot 2,1 mm","TIBHAR Aurus Soft, ovládání"
"TIBHAR Belag Aurus Soft schwarz 1,7 mm","Aurus Soft, stolní tenis"
"TIBHAR Belag Aurus Soft schwarz 1,9 mm","TIBHAR Aurus Soft, stolní tenis"
"TIBHAR Belag Aurus Soft schwarz 2,1 mm","TIBHAR Aurus Soft, stolní tenis"
"TIBHAR Belag Aurus Sound rot 1,7 mm","zvuk Aurus, měkký potah"
"TIBHAR Belag Aurus Sound rot 1,9 mm","TIBHAR Aurus Sound, měkká varianta"
"TIBHAR Belag Aurus Sound rot 2,1 mm","TIBHAR Aurus Sound, pingpongová podložka"
"TIBHAR Belag Aurus Sound schwarz 1,7 mm","TIBHAR Aurus zvuk, měkká houba"
"TIBHAR Belag Aurus Sound schwarz 1,9 mm","TIBHAR Aurus Sound, pingpongová guma"
"TIBHAR Belag Aurus Sound schwarz 2,1 mm","TIBHAR Aurus Sound, měkký potah"
"TIBHAR Belag Ellen DEF rot 1,5 mm","antispin, obranný"
"TIBHAR Belag Ellen DEF rot 2,0 mm","Antispin, Ovládání míče"
"TIBHAR Belag Ellen DEF schwarz 1,5 mm","Antispin, Kontrola míče"
"TIBHAR Belag Ellen DEF schwarz 2,0 mm","Antispin, Kontrola"
"TIBHAR Belag Ellen OFF rot 1,5 mm","Antitopspin, Ovládání míče"
"TIBHAR Belag Ellen OFF rot 2,0 mm","protáčení odolnost, kontrola míče"
"TIBHAR Belag Ellen OFF schwarz 1,5 mm","kontrólní potah, antispin"
"TIBHAR Belag Ellen OFF schwarz 2,0 mm","Antitopspin, Ballkontrola"
"TIBHAR Belag Evolution EL-P rot 1,8 mm","střední houba, elastická přilnavost"
"TIBHAR Belag Evolution EL-P rot 2,0 mm","TIBHAR Evolution, elastický střed"
"TIBHAR Belag Evolution EL-P rot 2,2 mm","TIBHAR Evolution EL-P, střední tvrdost"
"TIBHAR Belag Evolution EL-P schwarz 1,8 mm","TIBHAR Evolution EL-P, elastický potah"
"TIBHAR Belag Evolution EL-P schwarz 2,0 mm","TIBHAR Evolution EL-P, středně tvrdý potah"
