"KEY","VALUE"
"potah Andro Blowfish","Blowfish"
"Potah Nittaku Best Anti","Best Anti"
"potah Andro Bype","Bype"
"potah Andro Bype SFX","Bype SFX"
"dřevo Andro Gauzy HL CO OFF","Gauzy HL CO OFF"
"dřevo Andro Gauzy SL OFF","Gauzy SL OFF"
"potah Andro Hexer Grip","Hexer Grip"
"potah Andro Hexer Grip SFX","Hexer Grip SFX"
"potah Andro Hexer Powergrip","Hexer Powergrip"
"potah Andro Hexer Powergrip SFX","Hexer Powergrip SFX"
"potah Andro Hexer Powersponge","Hexer Powersponge"
"dřevo Andro Performance","Performance"
"potah Andro Plaxon 350","Plaxon 350"
"potah Andro Plaxon 400","Plaxon 400"
"potah Andro Power 3","Power 3"
"potah Andro Rasant Chaos","Rasant Chaos"
"potah Andro Rasanter C45","Rasanter C45"
"potah Andro Rasanter C48","Rasanter C48"
"potah Andro Rasanter C53","Rasanter C53"
"potah Andro Rasanter R37","Rasanter R37"
"potah Andro Rasanter R42","Rasanter R42"
"potah Andro Rasanter R45","Rasanter R45"
"potah Andro Rasanter R47","Rasanter R47"
"potah Andro Rasanter R48","Rasanter R48"
"potah Andro Rasanter R50","Rasanter R50"
"potah Andro Rasanter R53","Rasanter R53"
"potah Andro Rasanter V42","Rasanter V42"
"potah Andro Rasanter V47","Rasanter V47"
"potah Andro Shifter","Shifter"
"dřevo Andro Timber 5 All/s","Timber 5 ALL/S"
"dřevo Andro Treiber FO Off/s","Treiber FO OFF/S"
"dřevo Andro Treiber FI OFF","Treiber FI OFF"
"Balíček karet Balíček Karet",""
"dřevo Barna Champion","Champion"
"potah Barna Classic Defence","Classic Defence"
"potah Barna Extra Spin","Extra Spin"
"potah Barna Half Long","Half Long"
"potah Barna Legend Classic","Legend Classic"
"potah Barna Legend Fire","Legend Fire"
"potah Barna Legend Long","Legend Long"
"potah Barna Original Anti","Original Anti"
"potah Barna Spin Trick","Spin Trick"
"potah Barna Super Glanti","Super Glanti"
"potah Barna Super Glanti Soft","Super Glanti Soft"
"dřevo Barna Triumph","Triumph"
"dřevo Barna Victory","Victory"
"dřevo Barna Winner","Winner"
"potah Barna Original Turbulent","Original Turbulent"
"potah Bomb Talent","Talent"
"potah Butterfly Aibiss","Aibiss"
"potah Butterfly Bryce Highspeed","Bryce Highspeed"
"potah Butterfly Challenger Attack","Challenger Attack"
"Čistič Butterfly Combi Cleaner New","Combi Cleaner New"
"potah Butterfly Dignics 05","Dignics 05"
"potah Butterfly Dignics 09C","Dignics 09C"
"potah Butterfly Dignics 64","Dignics 64"
"dřevo Butterfly Diode V","Diode V"
"síťka Butterfly Elite","Elite"
"síťka Butterfly Europa II","Europa II"
"potah Butterfly Feint AG","Feint AG"
"potah Butterfly Feint Long II","Feint Long II"
"potah Butterfly Feint Soft","Feint Soft"
"potah Butterfly Glayzer","Glayzer"
"potah Butterfly Glayzer 09C","Glayzer 09C"
"dřevo Butterfly Harimoto Innerforce ALC","Harimoto Innerforce ALC"
"potah Butterfly Impartial XB","Impartial XB"
"dřevo Butterfly Innerforce Layer ALC","Innerforce Layer ALC"
"dřevo Butterfly Innerforce Layer Alc.s","Innerforce Layer ALC.S"
"dřevo Butterfly Jun Mizutani","Jun Mizutani"
"dřevo Butterfly Korbel (japan)","Korbel (Japan)"
"dřevo Butterfly Maze Magic","Maze Magic"
"Míčky Butterfly R40+ ***","R40+ ***"
"potah Butterfly Orthodox","Orthodox"
"dřevo Butterfly Ovtcharov S1","Ovtcharov S1"
"dřevo Butterfly Petr Korbel","Petr Korbel"
"potah Butterfly Roundell","Roundell"
"potah Butterfly Rozena","Rozena"
"Čistič Butterfly Rubber Cleaner New","Rubber Cleaner New"
"potah Butterfly Sriver FX","Sriver FX"
"potah Butterfly Sriver L","Sriver L"
"potah Butterfly Super Anti","Super Anti"
"Síťka Butterfly Spring","Spring"
"potah Butterfly Tackiness Chop","Tackiness Chop"
"potah Butterfly Tackiness Chop II","Tackiness Chop II"
"potah Butterfly Tackiness Drive","Tackiness Drive"
"potah Butterfly Tenergy 05","Tenergy 05"
"potah Butterfly Tenergy 05 FX","Tenergy 05 FX"
"potah Butterfly Tenergy 05 Hard","Tenergy 05 Hard"
"potah Butterfly Tenergy 19","Tenergy 19"
"potah Butterfly Tenergy 64","Tenergy 64"
"potah Butterfly Tenergy 64 FX","Tenergy 64 FX"
"potah Butterfly Tenergy 80","Tenergy 80"
"potah Butterfly Tenergy 80 FX","Tenergy 80 FX"
"dřevo Butterfly Timo Boll ALC","Timo Boll ALC"
"dřevo Butterfly Timo Boll ZLC","Timo Boll ZLC"
"dřevo Butterfly Timo Boll ZLF","Timo Boll ZLF"
"dřevo Butterfly Viscaria","Viscaria"
"dřevo Butterfly Z. Primorac (japan)","Z. Primorac (Japan)"
"dřevo Butterfly Zoran Primorac","Zoran Primorac"
"potah Butterfly Ilius B","Ilius B"
"potah Butterfly Ilius S","Ilius S"
"potah Der Materialspezialist Beast Anti","Beast Anti"
"potah Der Materialspezialist Best Anti Def","Best Anti Def"
"dřevo Der Materialspezialist Blockbuster","Blockbuster"
"potah Der Materialspezialist Burnout","Burnout"
"dřevo Der Materialspezialist Defensor","Defensor"
"dřevo Der Materialspezialist Destroyer","Destroyer"
"potah Der Materialspezialist Diabolic","Diabolic"
"potah Der Materialspezialist Elimination Extra Long","Elimination Extra Long"
"dřevo Der Materialspezialist Excalibur","Excalibur"
"potah Der Materialspezialist Firestorm","Firestorm"
"potah Der Materialspezialist Firestorm Soft","Firestorm soft"
"potah Der Materialspezialist Flashback","Flashback"
"potah Der Materialspezialist Hardcore","Hardcore"
"potah Der Materialspezialist Hardcore Speed","Hardcore Speed"
"potah Der Materialspezialist Hellcat","Hellcat"
"potah Der Materialspezialist Hellracer","Hellracer"
"dřevo Der Materialspezialist Invictus","Invictus"
"potah Der Materialspezialist Kamikaze","Kamikaze"
"potah Der Materialspezialist Killing Defender Soft","Killing Defender Soft"
"potah Der Materialspezialist L.s.d Extra Long","L.S.D Extra Long"
"potah Der Materialspezialist L.s.d. Long Super Defence","L.S.D. Long Super Defence"
"potah Der Materialspezialist Long Super Defence","Long Super Defence"
"potah Der Materialspezialist Master Anti","Master Anti"
"potah Der Materialspezialist Nightmare Anti","Nightmare Anti"
"potah Der Materialspezialist Outkill","Outkill"
"dřevo Der Materialspezialist Power Control","Power Control"
"potah Der Materialspezialist Predator","Predator"
"dřevo Der Materialspezialist Protector","Protector"
"potah Der Materialspezialist Rebellion","Rebellion"
"potah Der Materialspezialist Scandal","Scandal"
"potah Der Materialspezialist Shockwave","Shockwave"
"potah Der Materialspezialist Spectre","Spectre"
"potah Der Materialspezialist Spinfire","Spinfire"
"potah Der Materialspezialist Spinparasite","Spinparasite"
"potah Der Materialspezialist Superwall","Superwall"
"potah Der Materialspezialist Tenacious Violence","Tenacious Violence"
"potah Der Materialspezialist Tenacious Violence Speed","Tenacious Violence Speed"
"dřevo Der Materialspezialist Terror","Terror"
"dřevo Der Materialspezialist The Wall","The Wall"
"potah Der Materialspezialist Transformer","Transformer"
"dřevo Der Materialspezialist Trouble","Trouble"
"potah Der Materialspezialist Turtle Twister","Turtle Twister"
"potah Der Materialspezialist Turtle Twister Soft","Turtle Twister Soft"
"potah Der Materialspezialist Undertaker","Undertaker"
"dřevo Der Materialspezialist Wizard","Wizard"
"dřevo Der Materialspezialist Wizard Fire","Wizard Fire"
"potah DHS Dragonow","Dragonow"
"míček DHS Dual D40+ ***","Dual D40+ ***"
"potah DHS Hurricane 8","Hurricane 8"
"dřevo DHS Wang Liqin Carbon","Wang Liqin Carbon"
"dřevo Dingo Swiss Aluminium OFF","Aluminium OFF"
"dřevo Dingo Swiss Carbon DLC OFF+","Carbon DLC OFF+"
"dřevo Dingo Swiss Carbon Light ALL","Carbon Light ALL"
"dřevo Dingo Swiss Yin Yan ALL","Yin Yan ALL"
"potah Dingo Swiss Zik Zak","Zik Zak"
"síťka Donic Stress","Stress"
"potah Donic Acuda S1","Acuda S1"
"potah Donic Acuda S1 Turbo","Acuda S1 Turbo"
"potah Donic Acuda S2","Acuda S2"
"potah Donic Acuda S3","Acuda S3"
"potah Donic Akkadi Taichi","Akkadi Taichi"
"dřevo Donic Alligator Combi","Alligator Combi"
"potah Donic Alligator DEF","Alligator DEF"
"potah Donic Alligator Anti","Alligator Anti"
"dřevo Donic Appelgren Exclusive AR","Appelgren Exclusive AR"
"potah Donic Baracuda","Baracuda"
"potah Donic Baracuda Big Slam","Baracuda Big Slam"
"lepidlo Donic Blue Contact","Blue Contact"
"potah Donic Bluefire Big Slam","Bluefire Big Slam"
"potah Donic Bluefire M1","Bluefire M1"
"potah Donic Bluefire M1 Turbo","Bluefire M1 Turbo"
"potah Donic Bluefire M2","Bluefire M2"
"potah Donic Bluefire M3","Bluefire M3"
"potah Donic Bluegrip C1","Bluegrip C1"
"potah Donic Bluegrip C2","Bluegrip C2"
"potah Donic Bluegrip R1","BlueGrip R1"
"potah Donic Bluegrip S1","Bluegrip S1"
"potah Donic Bluegrip S2","Bluegrip S2"
"potah Donic Bluestar A1","Bluestar A1"
"potah Donic Bluestorm Pro","Bluestorm Pro"
"potah Donic Bluestorm Pro AM","Bluestorm Pro AM"
"potah Donic Bluestorm Z1","Bluestorm Z1"
"potah Donic Bluestorm Z1 Turbo","Bluestorm Z1 Turbo"
"potah Donic Bluestorm Z2","Bluestorm Z2"
"potah Donic Bluestorm Z3","Bluestorm Z3"
"dřevo Donic Burn OFF-","Burn OFF-"
"dřevo Donic Classic Allround","Classic Allround"
"dřevo Donic Classic Offensive","Classic Offensive"
"potah Donic Coppa","Coppa"
"potah Donic Coppa Tagora","Coppa Tagora"
"potah Donic Coppa Tenero","Coppa Tenero"
"potah Donic Coppa X1 Gold","Coppa X1 Gold"
"potah Donic Coppa X2 Platin Soft","Coppa X2 Platin Soft"
"potah Donic Coppa X3 Silver","Coppa X3 Silver"
"potah Donic Desto F1","Desto F1"
"potah Donic Desto F1 Plus","Desto F1 Plus"
"potah Donic Desto F2","Desto F2"
"potah Donic Desto F3","Desto F3"
"potah Donic Desto F4","Desto F4"
"dřevo Donic Original Carbospeed","Original Carbospeed"
"dřevo Donic Persson Dotec OFF","Persson Dotec OFF"
"dřevo Donic Persson Exclusive OFF","Persson Exclusive OFF"
"potah Donic Piranja CD","Piranja CD"
"potah Donic Quattro","Quattro"
"robot Donic Robopong 1055","Robopong 1055"
"robot Donic Robopong 2055","Robopong 2055"
"sběrač míčků Donic Sběrač Míčků",""
"potah Donic Sonex JP Gold","Sonex JP Gold"
"potah Donic Spike P1","Spike P1"
"potah Donic Spike P2","Spike P2"
"obuv Donic Ultra Power II","Ultra Power II"
"potah Donic Vario","Vario"
"potah Donic Vario Big Slam","Vario Big Slam"
"potah Donic Vario Soft","Vario Soft"
"dřevo Donic Waldner Allplay","Waldner Allplay"
"dřevo Donic Waldner Exclusive AR+","Waldner Exclusive AR+"
"dřevo Donic Waldner Offensive 2016","Waldner Offensive 2016"
"dřevo Donic Wang Xi Dotec Control Plus","Wang Xi Dotec Control Plus"
"potah Dr. Neubauer ABS","ABS"
"potah Dr. Neubauer Aggressor","Aggressor"
"potah Dr. Neubauer Boomerang Classic","Boomerang Classic"
"potah Dr. Neubauer Diamant","Diamant"
"potah Dr. Neubauer Domination Speed 2","Domination Speed 2"
"potah Dr. Neubauer Fighter","Fighter"
"potah Dr. Neubauer Leopard","Leopard"
"potah Dr. Neubauer Nugget","Nugget"
"potah Dr. Neubauer Number 1","Number 1"
"potah Dr. Neubauer Power Attack","Power Attack"
"potah Dr. Neubauer Special Defence","Special Defence"
"potah Friendship Legend 105","Legend 105"
"dřevo Gewo Balsa Carbon 375","Balsa Carbon 375"
"dřevo Gewo Balsa Carbon 575","Balsa Carbon 575"
"dřevo Gewo Balsa Carbon 775","Balsa Carbon 775"
"dřevo Gewo In-force Pbo-pc OFF","In-Force PBO-PC OFF"
"potah Hallmark Mirage","Mirage"
"potah Hallmark Panther","Panther"
"tričko Andro Alpha-t","Alpha-T"
"polokošile Andro Ataxa","Ataxa"
"tričko Andro Ataxa Women","Ataxa Women"
"tričko Andro Avos","Avos"
"Potah Andro Blowfish","Blowfish"
"Potah Andro Hexer Duro","Hexer Duro"
"Potah Andro Hexer Grip","Hexer Grip"
"Potah Andro Hexer Grip SFX","Hexer Grip SFX"
"Potah Andro Hexer HD","Hexer HD"
"Potah Andro Hexer Plus","Hexer Plus"
"Potah Andro Hexer Powergrip","Hexer Powergrip"
"Potah Andro Hexer Powergrip SFX","Hexer Powergrip SFX"
"Potah Andro Hexer Powersponge","Hexer Powersponge"
"Potah Andro Hexer","Hexer"
"Potah Andro Impuls Powersponge","Impuls Powersponge"
"Potah Andro Impuls Speed","Impuls Speed"
"Potah Andro Rasant Chaos","Rasant Chaos"
"Potah Andro Rasanter C45","Rasanter C45"
"Potah Andro Rasanter V42","Rasanter V42"
"Potah Andro Rasanter V47","Rasanter V47"
"Potah Andro Shifter","Shifter"
"Dřevo Andro Gauzy BL7","Gauzy BL7"
"Dřevo Andro Gauzy SL","Gauzy SL"
"Dřevo Andro Kanter CO OFF","Kanter CO OFF"
"Dřevo Andro Kanter FO All/s","Kanter FO ALL/S"
"Dřevo Andro Kanter FO OFF","Kanter FO OFF"
"Dřevo Andro Novacell All/s","Novacell ALL/S"
"Dřevo Andro Novacell Off/s","Novacell OFF/S"
"Dřevo Andro Synteliac VCI","Synteliac VCI"
"Dřevo Andro Synteliac VCO","Synteliac VCO"
"Dřevo Andro Synteliac ZCI","Synteliac ZCI"
"Dřevo Andro Synteliac ZCO","Synteliac ZCO"
"Dřevo Andro Timber 5 ALL","Timber 5 ALL"
"Dřevo Andro Timber 5 ALL Black","Timber 5 ALL Black"
"Dřevo Andro Treiber CI OFF","Treiber CI OFF"
"Dřevo Andro Treiber CO All/s","Treiber CO ALL/S"
"Dřevo Andro Treiber CO Off/s","Treiber CO OFF/S"
"Dřevo Andro Treiber FO Off/s","Treiber FO OFF/S"
"Dřevo Andro Andro Wanokiwami Midori DEF","Wanokiwami Midori DEF"
"Dřevo Andro Wanokiwami Midori DEF","Wanokiwami Midori DEF"
"Dřevo Andro Wanokiwami Ren","Wanokiwami Ren"
"Mikina Andro Doley","Doley"
"obuv Andro Cross Step 2","Cross Step 2"
"boty Andro Cross Step 2","Cross Step 2"
"boty 5 Cross Step 2","Cross Step 2"
"Kraťasy Andro Cuso","Cuso"
"Kraťasy Andro Tarox","Tarox"
"taška Andro Moriva L","Moriva L"
"Triko Andro Melange Alpha","Melange Alpha"
"polokošile Andro Avos Women","Avos Women"
"šortky Andro Cuso","Cuso"
"tričko Andro Dexar","Dexar"
"kalhoty Andro Doley","Doley"
"potah Andro Hexer","Hexer"
"potah Andro Hexer Duro","Hexer Duro"
"potah Andro Hexer HD","Hexer HD"
"potah Andro Impuls Powersponge","Impuls Powersponge"
"dřevo Andro Inizio OFF","Inizio OFF"
"tričko Andro Ivers","Ivers"
"sukně Andro Kaja","Kaja"
"dřevo Andro Kanter CO OFF","Kanter CO OFF"
"dřevo Andro Kanter FO OFF","Kanter FO OFF"
"polokošile Andro Lavor","Lavor"
"kalhoty Andro Marbery","Marbery"
"tričko Andro Melange Alpha","Melange Alpha"
"tričko Andro Melange Alpha 2024","Melange Alpha 2024"
"batoh Andro Moriva","Moriva"
"Pouzdro Andro Moriva","Moriva"
"polokošile Andro Nayton","Nayton"
"síťka Andro Niveau","Niveau"
"dřevo Andro Novacell All/s","Novacell ALL/S"
"dřevo Andro Novacell OFF","Novacell OFF"
"dřevo Andro Novacell Off/s","Novacell OFF/S"
"ponožky Andro Pace","Pace"
"Pálka Andro Upgrade","Upgrade"
"ručník Andro Energy Cell M","Energy Cell M"
"bunda Andro Salivan","Salivan"
"dřevo Andro Synteliac VCI","Synteliac VCI"
"dřevo Andro Synteliac VCO","Synteliac VCO"
"dřevo Andro Synteliac ZCI","Synteliac ZCI"
"dřevo Andro Synteliac ZCO","Synteliac ZCO"
"dřevo Andro Timber 5 ALL","Timber 5 ALL"
"dřevo Andro Timber 5 ALL Black","Timber 5 ALL Black"
"dřevo Andro Timber 5 DEF","Timber 5 DEF"
"dřevo Andro Timber 7 OFF","Timber 7 OFF"
"dřevo Andro Timber 7 Off/s","Timber 7 OFF/S"
"tričko Andro Tooper","Tooper"
"šortky Andro Torin","Torin"
"dřevo Andro TP Ligna ALL","TP Ligna ALL"
"dřevo Andro TP Ligna CI OFF","TP Ligna CI OFF"
"dřevo Andro TP Ligna CO OFF","TP Ligna CO OFF"
"dřevo Andro Treiber CO All/s","Treiber CO ALL/S"
"dřevo Andro Treiber CO Off/s","Treiber CO OFF/S"
"tričko Andro Tylos","Tylos"
"dřevo Andro Wanokiwami Midori DEF","Wanokiwami Midori DEF"
"dřevo Andro Wanokiwami Ren OFF","Wanokiwami Ren OFF"
"Potah Armstrong Twister","Twister"
"Dřevo Avalox Blue Thunder 550","Blue Thunder 550"
"Dřevo Avalox Blue Thunder 555","Blue Thunder 555"
"Dřevo Avalox Blue Thunder 777","Blue Thunder 777"
"Dřevo Avalox J-aramid","J-Aramid"
"Dřevo Avalox J-power","J-Power"
"Dřevo Avalox J-tech","J-Tech"
"Dřevo Avalox P900","P900"
"ohrádka Andro Stabilo","Stabilo"
"Potah Barna Classic Defence","Classic Defence"
"Potah Barna Barna Extra Spin","Extra Spin"
"Potah Barna Extra Spin","Extra Spin"
"Potah Barna Legend Classic","Legend Classic"
"Potah Barna Legend Fire","Legend Fire"
"Potah Barna Legend Half Long","Legend Half Long"
"Potah Barna Legend Long","Legend Long"
"Potah Barna Original Anti","Original Anti"
"Potah Barna Super Glanti Absorber","Super Glanti Absorber"
"Potah Barna Super Glanti Attack","Super Glanti Attack"
"Potah Barna Super Glanti","Super Glanti"
"Potah Barna Turbulent","Turbulent"
"Potah Barna Virus-2","Virus-2"
"Dřevo Barna Victory","Victory"
"Batoh Andro Moriva","Moriva"
"Batoh Tibhar Etna","Etna"
"Batoh Tibhar Hong Kong","Hong Kong"
"Batoh Tibhar Jakarta","Jakarta"
"Batoh Tibhar Macao","Macao"
"Batoh Tibhar Mesh","Mesh"
"Batoh Tibhar Shanghai","Shanghai"
"dřevo Blackstone Blackstone Junior","Junior"
"Potah Bomb Talent","Talent"
"Boty Andro Cross Step 2","Cross Step 2"
"Boty Andro Shuffle Step","Shuffle Step"
"Boty Andro Shuffle Step 2 2024","Shuffle Step 2 2024"
"Boty Andro Shuffle Step 2","Shuffle Step 2"
"Boty Tibhar Exclusive","Exclusive"
"Boty Xiom FT Igre","FT Igre"
"dřevo Butterfly Allround NEW","Allround NEW"
"dřevo Butterfly Amultart ZLC","Amultart ZLC"
"tričko Butterfly Anniversary 70","Anniversary 70"
"tričko Butterfly Antei","Antei"
"tričko Butterfly Antei Lady","Antei Lady"
"šortky Butterfly Apego NEW","Apego NEW"
"dřevo Butterfly Apolonia ZLC","Apolonia ZLC"
"bunda Butterfly Avio Lady","Avio Lady"
"dřevo Butterfly Balsa Carbo X5 22","Balsa Carbo X5 22"
"dřevo Butterfly Balsa Carbo X7","Balsa Carbo X7"
"polokošile Butterfly Bamboo","Bamboo"
"dřevo Butterfly Boll Forte III","Boll Forte III"
"dřevo Butterfly Boll Fortissimo","Boll Fortissimo"
"dřevo Butterfly Boll Mezzoforte","Boll Mezzoforte"
"sukně Butterfly Chiara","Chiara"
"síťka Butterfly Club","Club"
"pouzdro Butterfly Curve Case II","Curve Case II"
"polokošile Butterfly Daito","Daito"
"dřevo Butterfly Diode Pro","Diode Pro"
"pálka Butterfly Easy","Easy"
"ponožky Butterfly Ebina","Ebina"
"síťka Butterfly Elite Clip","Elite Clip"
"dřevo Butterfly Falcima","Falcima"
"dřevo Butterfly Fan Zhendong ALC","Fan Zhendong ALC"
"dřevo Butterfly Fan Zhendong CNF","Fan Zhendong CNF"
"dřevo Butterfly Fan Zhendong Super ALC","Fan Zhendong Super ALC"
"dřevo Butterfly Fan Zhendong Super ZLC","Fan Zhendong Super ZLC"
"dřevo Butterfly Fan Zhendong ZLC","Fan Zhendong ZLC"
"potah Butterfly Flextra","Flextra"
"dřevo Butterfly Franziska Innerforce ZLC","Franziska Innerforce ZLC"
"lepidlo Butterfly Free Chack Pro II","Free Chack Pro II"
"ponožky Butterfly Germany 15 Kotníkové","Germany 15 kotníkové"
"bunda Butterfly Germany 18","Germany 18"
"kalhoty Butterfly Germany 18 Kalhoty","Germany 18"
"tričko Butterfly Germany 18 Lady","Germany 18 Lady"
"šortky Butterfly Germany 18 Lady","Germany 18 Lady"
"ponožky Butterfly Germany 23 Kotníkové","Germany 23 kotníkové"
"čelenka Butterfly Hachimaki","Hachimaki"
"bunda Butterfly Hadano","Hadano"
"dřevo Butterfly Hadraw 5","Hadraw 5"
"dřevo Butterfly Hadraw VR","Hadraw VR"
"dřevo Butterfly Harimoto Innerforce Super ALC","Harimoto Innerforce Super ALC"
"dřevo Butterfly Harimoto Innerforce Super ZLC","Harimoto Innerforce Super ZLC"
"dřevo Butterfly Harimoto Innerforce ZLC","Harimoto Innerforce ZLC"
"tričko Butterfly Higo Lady","Higo Lady"
"bunda Butterfly Ikeda","Ikeda"
"dřevo Butterfly Innerforce Layer ZLF","Innerforce Layer ZLF"
"dřevo Butterfly Innershield Layer ZLF","Innershield Layer ZLF"
"polokošile Butterfly Izumo","Izumo"
"kalhoty Butterfly Izumo Kalhoty","Izumo"
"polokošile Butterfly Izumo Lady","Izumo Lady"
"ponožky Butterfly Jiro","Jiro"
"dřevo Butterfly Jun Mizutani Super ZLC","Jun Mizutani Super ZLC"
"dřevo Butterfly Jun Mizutani ZLC","Jun Mizutani ZLC"
"pálka Butterfly Junior","Junior"
"ponožky Butterfly Kado Kotníkové","Kado kotníkové"
"bunda Butterfly Kano","Kano"
"bunda Butterfly Kano Lady","Kano Lady"
"batoh Butterfly Kanoy","Kanoy"
"taška Butterfly Kanoy Maxi Taška","Kanoy Maxi"
"tričko Butterfly Kariya","Kariya"
"bunda Butterfly Kariya","Kariya"
"kalhoty Butterfly Kariya Kalhoty","Kariya"
"tričko Butterfly Kariya Lady","Kariya Lady"
"batoh Butterfly Kashiwa","Kashiwa"
"taška Butterfly Kashiwa Midi","Kashiwa Midi"
"taška Butterfly Kashiwa Sport Taška","Kashiwa Sport"
"taška Butterfly Kashiwa Trolley","Kashiwa Trolley"
"tričko Butterfly Kido","Kido"
"kalhoty Butterfly Kido Kalhoty","Kido"
"tričko Butterfly Kido Lady","Kido Lady"
"bunda Butterfly Kido Lady","Kido Lady"
"batoh Butterfly Kitami Batoh","Kitami"
"bunda Butterfly Kitao","Kitao"
"kalhoty Butterfly Kitao Kalhoty","Kitao"
"dřevo Butterfly Korbel SK7","Korbel SK7"
"polokošile Butterfly Kosay Lady","Kosay Lady"
"bunda Butterfly Kuji","Kuji"
"obuv Butterfly Lezoline Gigu","Lezoline Gigu"
"boty Butterfly Lezoline Rifones","Lezoline Rifones"
"obuv Butterfly Lezoline Vilight","Lezoline Vilight"
"dřevo Butterfly Lin Gaoyuan ALC","Lin Gaoyuan ALC"
"dřevo Butterfly Lin Yun-ju Super ZLC","Lin Yun-Ju Super ZLC"
"pálka Butterfly Marcos Freitas MFX4","Marcos Freitas MFX4"
"dřevo Butterfly Matsudaira ALC","Matsudaira ALC"
"dřevo Butterfly Maze Advance","Maze Advance"
"dřevo Butterfly Midi Dřevo","Midi"
"Mikina Butterfly Mikina Kihon","Kihon"
"dřevo Butterfly Mini Dřevo","Mini"
"tričko Butterfly Mira Lady","Mira Lady"
"bunda Butterfly Mira Lady","Mira Lady"
"kalhoty Butterfly Mira Lady Kalhoty","Mira Lady"
"Míčky Butterfly Butterfly R40+ ***","R40+ ***"
"polokošile Butterfly Nagano","Nagano"
"tričko Butterfly Nagano Lady","Nagano Lady"
"bunda Butterfly Naoki","Naoki"
"polokošile Butterfly Naomi","Naomi"
"bunda Butterfly Nash","Nash"
"kalhoty Butterfly Nash Kalhoty","Nash"
"tričko Butterfly Nash Lady","Nash Lady"
"šortky Butterfly Niiza Lady","Niiza Lady"
"dřevo Butterfly Offensive New","Offensive New"
"dřevo Butterfly Ovtcharov Innerforce ALC","Ovtcharov Innerforce ALC"
"dřevo Butterfly Ovtcharov S2","Ovtcharov S2"
"kalhoty Butterfly Passo Kalhoty","Passo"
"síťka Butterfly Perfekt II","Perfekt II"
"tričko Butterfly Polo Yaizu","Polo Yaizu"
"dřevo Butterfly Primorac Carbon","Primorac Carbon"
"polokošile Butterfly Puren","Puren"
"bunda Butterfly Puren","Puren"
"kalhoty Butterfly Puren Kalhoty","Puren"
"polokošile Butterfly Puren Lady","Puren Lady"
"páska na hranu pálky Butterfly Tenergy","Tenergy"
"dřevo Butterfly Revoldia CNF","Revoldia CNF"
"potah Butterfly Roundell Hard","Roundell Hard"
"potah Butterfly Roundell Soft","Roundell Soft"
"ručník Butterfly Germany 2018","Germany 2018"
"tričko Butterfly Ryo","Ryo"
"tričko Butterfly Saijo","Saijo"
"dřevo Butterfly Sardius","Sardius"
"tričko Butterfly Shiro","Shiro"
"bunda Butterfly Shiro","Shiro"
"síťka Butterfly Snap","Snap"
"tričko Butterfly Special","Special"
"potah Butterfly Sriver EL","Sriver EL"
"pálka Butterfly Starter","Starter"
"tričko Butterfly Sutairu Lady","Sutairu Lady"
"mikina Butterfly Tajimi","Tajimi"
"kalhoty Butterfly Takeo Kalhoty","Takeo"
"kalhoty Butterfly Taori Kalhoty","Taori"
"pálka Butterfly Tiago Apolonia TAX3","Tiago Apolonia TAX3"
"dřevo Butterfly Timo Boll 30th Anniversary","Timo Boll 30th Anniversary"
"dřevo Butterfly Timo Boll CAF","Timo Boll CAF"
"dřevo Butterfly Timo Boll J","Timo Boll J"
"dřevo Butterfly Timo Boll TJ","Timo Boll TJ"
"tričko Butterfly TOC","TOC"
"kufr Butterfly Torori Kufr","Torori"
"bunda Butterfly Větrovka Nationen","Větrovka Nationen"
"tričko Butterfly Xero","Xero"
"bunda Butterfly Xero","Xero"
"kalhoty Butterfly Xero New Kalhoty","Xero New"
"dřevo Butterfly Xstar V","Xstar V"
"tričko Butterfly YAO","YAO"
"bunda Butterfly Yao","Yao"
"kalhoty Butterfly YAO Kalhoty","YAO"
"tričko Butterfly Yasu","Yasu"
"tričko Butterfly Yasu (bavlna)","Yasu (bavlna)"
"bunda Butterfly Yasu","Yasu"
"kalhoty Butterfly Yasu Kalhoty","Yasu"
"polokošile Butterfly Yasu Lady","Yasu Lady"
"kalhoty Butterfly Yasu Lady","Yasu Lady"
"šortky Butterfly Yasu Šortky","Yasu"
"taška Butterfly Yasyo Maxi","Yasyo Maxi"
"dřevo Butterfly Zhang Jike Super ZLC","Zhang Jike Super ZLC"
"dřevo Butterfly Zhang Jike T5000","Zhang Jike T5000"
"pálka Butterfly Zhang Jike ZJX6","Zhang Jike ZJX6"
"dřevo Butterfly Zhang Jike ZLC","Zhang Jike ZLC"
"šortky Butterfly Higo","Higo"
"šortky Butterfly Meranji","Meranji"
"Polokošile Contra Targa","Targa"
"potah Der Materialspezialist Transformer Extra Slow","Transformer Extra Slow"
"Potah Der Materialspezialist Burnout","Burnout"
"Potah Der Materialspezialist Diabolic Special","Diabolic Special"
"Potah Der Materialspezialist Elimination Extra Long","Elimination Extra Long"
"Potah Der Materialspezialist Elite Long","Elite Long"
"Potah Der Materialspezialist Fakir","Fakir"
"Potah Der Materialspezialist Firestorm","Firestorm"
"Potah Der Materialspezialist Firestorm Soft","Firestorm Soft"
"Potah Der Materialspezialist Flashback","Flashback"
"Potah Der Materialspezialist Hardcore","Hardcore"
"Potah Der Materialspezialist Hardcore Speed","Hardcore Speed"
"Potah Der Materialspezialist Hellcat","Hellcat"
"Potah Der Materialspezialist Hellracer","Hellracer"
"Potah Der Materialspezialist Kamikaze","Kamikaze"
"Potah Der Materialspezialist Killing Defender","Killing Defender"
"Potah Der Materialspezialist Killing Defender Soft","Killing Defender Soft"
"Potah Der Materialspezialist Outkill","Outkill"
"Potah Der Materialspezialist Power-pipes","Power-Pipes"
"Potah Der Materialspezialist Predator","Predator"
"Potah Der Materialspezialist Rebellion","Rebellion"
"Potah Der Materialspezialist Reflection","Reflection"
"Potah Der Materialspezialist Scandal","Scandal"
"Potah Der Materialspezialist Spectre","Spectre"
"Potah Der Materialspezialist Spinfire","Spinfire"
"Potah Der Materialspezialist Spinfire Soft","Spinfire Soft"
"Potah Der Materialspezialist Superwall","Superwall"
"Potah Der Materialspezialist Tenacious Violence","Tenacious Violence"
"Potah Der Materialspezialist Transformer Extra Slow","Transformer Extra Slow"
"Potah Der Materialspezialist Ttr-killer","TTR-Killer"
"Potah Der Materialspezialist Turtle Twister","Turtle Twister"
"Potah Der Materialspezialist Turtle Twister Soft","Turtle Twister Soft"
"Dřevo Der Materialspezialist Cubixx 100","Cubixx 100"
"Dřevo Der Materialspezialist Deluxe Carbon","Deluxe Carbon"
"Dřevo Der Materialspezialist Destroyer","Destroyer"
"Dřevo Der Materialspezialist Excalibur","Excalibur"
"Dřevo Der Materialspezialist Invictus","Invictus"
"Dřevo Der Materialspezialist Olympea","Olympea"
