"KEY","VALUE"
"Polokošile Gewo Aurora","Aurora"
"Polokošile Gewo Primus Mikrofaser","Primus Mikrofaser"
"Polokošile Gewo Ravenna","Ravenna"
"Polokošile Gewo Rovigo S18-7","Rovigo S18-7"
"Polokošile Gewo Teramo S18-1","Teramo S18-1"
"Polokošile Gewo Teramo S18-2","Teramo S18-2"
"Polokošile Gewo Toledo","Toledo"
"Dřevo Gewo GEWO Allround Classic","Allround Classic"
"Dřevo Gewo Allround Classic","Allround Classic"
"Dřevo Gewo Aruna Carbon ALL+","Aruna Carbon ALL+"
"Dřevo Gewo Aruna Carbon Basic","Aruna Carbon Basic"
"Dřevo Gewo Aruna Energy ARC OFF","Aruna Energy ARC OFF"
"Dřevo Gewo Aruna Hinoki Carbon OFF","Aruna Hinoki Carbon OFF"
"Dřevo Gewo Aruna Kids","Aruna Kids"
"Dřevo Gewo Aruna OFF","Aruna OFF"
"Dřevo Gewo GEWO Balsa Carbon 375","Balsa Carbon 375"
"Dřevo Gewo Balsa Carbon 575","Balsa Carbon 575"
"Dřevo Gewo Balsa Carbon 775","Balsa Carbon 775"
"Dřevo Gewo GEWO Balsa Carbon 775","Balsa Carbon 775"
"Dřevo Gewo Bence Majoros OFF","Bence Majoros OFF"
"Dřevo Gewo Ex-force Pbo-pc OFF","Ex-Force PBO-PC OFF"
"Dřevo Gewo Force ARC OFF","Force ARC OFF"
"Dřevo Gewo Hybrid Carbon A/speed All+","Hybrid Carbon A/Speed All+"
"Dřevo Gewo Hybrid Carbon M/speed Off-","Hybrid Carbon M/Speed Off-"
"Dřevo Gewo In-force ARC OFF-","In-Force ARC OFF-"
"Dřevo Gewo GEWO In-force ARC OFF-","In-Force ARC OFF-"
"Dřevo Gewo GEWO In-force Pbo-pc OFF","In-Force PBO-PC OFF"
"Dřevo Gewo In-force Pbo-pc OFF","In-Force PBO-PC OFF"
"Dřevo Gewo GEWO In-force S-hac OFF","In-force S-HAC OFF"
"Dřevo Gewo Power Control","Power Control"
"Dřevo Gewo Robles Hinoki Ex-carbon OFF","Robles Hinoki Ex-Carbon OFF"
"Dřevo Gewo Scepter PKC","Scepter PKC"
"Dřevo Gewo Sensus Carbo Speed","Sensus Carbo Speed"
"Dřevo Gewo Sensus Carbo Touch","Sensus Carbo Touch"
"Dřevo Gewo GEWO Sensus Powerfeeling","Sensus Powerfeeling"
"Dřevo Gewo Sensus Powerfeeling","Sensus Powerfeeling"
"Dřevo Gewo Talent ALL","Talent ALL"
"Dřevo Gewo Velox Alpha Def","Velox alpha Def"
"Dřevo Gewo Youngster","Youngster"
"Dřevo Gewo Zoom Balance All+","Zoom Balance All+"
"Dřevo Gewo Zoom Balance ALL+","Zoom Balance ALL+"
"Dřevo Gewo Zoom Pro Light OFF-","Zoom Pro Light OFF-"
"Dřevo Gewo Zoom Pro Light Off-","Zoom Pro Light Off-"
"Dřevo Gewo Zoom Pro OFF-","Zoom Pro OFF-"
"Mikina Gewo Cervo","Cervo"
"Mikina Gewo Marano","Marano"
"Mikina Gewo Ravenna","Ravenna"
"Mikina Gewo Toledo","Toledo"
"bunda Gewo Azaro Pro","Azaro Pro"
"bunda Gewo Xenon","Xenon"
"Síťka Gewo CS Profi","CS Profi"
"Síťka Gewo World Cup","World Cup"
"robot Gewo Alpha Nexxt","Alpha Nexxt"
"robot Gewo Delta Nexxt","Delta Nexxt"
"robot Gewo Omega Nexxt","Omega Nexxt"
"Pálka Gewo Carat","Carat"
"Pálka Gewo Champ","Champ"
"Pálka Gewo GEWO CS Energy Carbon","CS Energy Carbon"
"Pálka Gewo CS Energy Carbon Pro","CS Energy Carbon Pro"
"Pálka Gewo CS Energy Control","CS Energy Control"
"Pálka Gewo GEWO CS Energy Power","CS Energy Power"
"Pálka Gewo PS Blast Carbon","PS Blast Carbon"
"Pálka Gewo PS Blast Carbon Pro","PS Blast Carbon Pro"
"Pálka Gewo PS Blast Control","PS Blast Control"
"Pálka Gewo PS Blast Junior","PS Blast Junior"
"Pálka Gewo PS Blast Power","PS Blast Power"
"Pálka Gewo GEWO Rave Junior","Rave Junior"
"Pálka Gewo GEWO Rave Speed","Rave Speed"
"Sada Gewo Rave Speed","Rave Speed"
"stůl na stolní tenis Gewo GEWO AWR Outdoor","AWR Outdoor"
"stůl Gewo CS Pro Compact","CS Pro Compact"
"robot Gewo GEWO Alpha Nexxt","Alpha Nexxt"
"Polokošile Gewo Zamora","Zamora"
"Kraťasy Gewo Gandia","Gandia"
"Kraťasy Gewo Lagon","Lagon"
"Kraťasy Gewo Mattia","Mattia"
"Kraťasy Gewo Paza Color I","Paza Color I"
"Kraťasy Gewo Paza Color II","Paza Color II"
"Kraťasy Gewo Paza Color III","Paza Color III"
"ponožky Gewo Step Flex II","Step Flex II"
"pálka Gewo CS Energy Carbon","CS Energy Carbon"
"Triko Gewo Anzio","Anzio"
"Triko Gewo Arco","Arco"
"Triko Gewo Arona","Arona"
"Triko Gewo Bloques","Bloques"
"Triko Gewo Bloques Promo Nexxus Pro","Bloques Promo Nexxus Pro"
"Triko Gewo Eagle","Eagle"
"Triko Gewo Fermo","Fermo"
"Triko Gewo Ferrara","Ferrara"
"Triko Gewo Gandia","Gandia"
"Triko Gewo Matera","Matera"
"Triko Gewo Pesaro","Pesaro"
"Triko Gewo Pesaro Promo Nexxus Pro","Pesaro Promo Nexxus Pro"
"Triko Gewo Ravenna","Ravenna"
"Triko Gewo Riba Promo Nexxus Pro","Riba Promo Nexxus Pro"
"Triko Gewo Toledo","Toledo"
"Triko Gewo Trani","Trani"
"Stůl Gewo GEWO AWR Master Outdoor","AWR Master Outdoor"
"Stůl Gewo CS Pro Compact","CS Pro Compact"
"stůl Gewo GEWO AWR Easy Outdoor","AWR Easy Outdoor"
"stůl Gewo GEWO AWR Fun Outdoor","AWR Fun Outdoor"
"stůl Gewo GEWO AWR Outdoor","AWR Outdoor"
"oblečení Gewo GEWO Gandia","Gandia"
"tréninková souprava Gewo Ravenna","Ravenna"
"sportovní oblečení Gewo Ravenna","Ravenna"
"tréninková souprava Gewo Vigo","Vigo"
"bunda Gewo Aurora","Aurora"
"Potah Hallmark Clutter-lp","Clutter-LP"
"Potah Hallmark Confusion-lp","Confusion-LP"
"Potah Hallmark Destroyer","Destroyer"
"Potah Hallmark Devil-anti","Devil-Anti"
"Potah Hallmark Friction Special 2","Friction Special 2"
"Potah Hallmark Illusion-sp","Illusion-SP"
"Potah Hallmark Magic Pips","Magic Pips"
"Potah Hallmark Mega Spin Control","Mega Spin Control"
"Potah Hallmark Panther","Panther"
"Potah Hallmark Phoenix","Phoenix"
"Potah Hallmark Power Spin","Power Spin"
"Potah Hallmark Tactics LP","Tactics LP"
"Dřevo Hallmark Aurora","Aurora"
"Dřevo Hallmark Carbon Extreme","Carbon Extreme"
"Dřevo Hallmark Combination","Combination"
"Dřevo Hallmark Enigma","Enigma"
"Dřevo Hallmark Strategy","Strategy"
"Dřevo Hallmark Ultra","Ultra"
"Kalhoty Butterfly Luna","Luna"
"houbička Tibhar Jelenice","Jelenice"
"houbička Xiom RCS1","RCS1"
"mikina Andro Doley","Doley"
"dřevo Andro Gauzy BL5 ALL","Gauzy BL5 ALL"
"dřevo Andro Gauzy BL7 OFF","Gauzy BL7 OFF"
"potah Andro Impuls Speed","Impuls Speed"
"dřevo Andro Inizio ALL","Inizio ALL"
"dřevo Andro Kanter FO All/s","Kanter FO ALL/S"
"dres Andro Lavor Women","Lavor Women"
"Lepidlo Andro Pro Glu","Pro Glu"
"Taška Andro Moriva","Moriva"
"šortky Andro Tarox","Tarox"
"dřevo Andro Treiber CI OFF","Treiber CI OFF"
"bunda Butterfly Avio","Avio"
"potah Butterfly Feint Long 3","Feint Long 3"
"bunda Butterfly Fior","Fior"
"dřevo Butterfly Freitas ALC","Freitas ALC"
"bunda Butterfly Ikeda Lady","Ikeda Lady"
"dřevo Butterfly Innerforce Layer ZLC","Innerforce Layer ZLC"
"kalhoty Butterfly Kano","Kano"
"kalhoty Butterfly Kano Lady","Kano Lady"
"taška Butterfly Kanoy Trolley","Kanoy Trolley"
"pouzdro Butterfly Kibako","Kibako"
"kalhoty Butterfly Kido Lady","Kido Lady"
"taška Butterfly Kitami Midi","Kitami Midi"
"kalhoty Butterfly Kuji Kalhoty","Kuji"
"obuv Butterfly Lezoline Mach","Lezoline Mach"
"obuv Butterfly Lezoline TB","Lezoline TB"
"dřevo Butterfly Maxi Dřevo","Maxi"
"Mikina Butterfly Mikina Kihon Lady","Kihon Lady"
"šortky Butterfly Noda Lady","Noda Lady"
"Potah Butterfly Rubber Cleaner New","Rubber Cleaner New"
"dřevo Butterfly SK Carbon","SK Carbon"
"dřevo Butterfly Timo Boll Spirit","Timo Boll Spirit"
"dřevo Butterfly Viscaria Super ALC","Viscaria Super ALC"
"kalhoty Butterfly Xero","Xero"
"dřevo Butterfly Zhang Jike ALC","Zhang Jike ALC"
"potah DHS Hurricane 2 Neo","Hurricane 2 Neo"
"potah DHS Skyline 2 Neo","Skyline 2 Neo"
"dřevo Donic Appelgren Allplay","Appelgren Allplay"
"tričko Donic Atlas","Atlas"
"dřevo Donic Burn ALL+","Burn ALL+"
"dřevo Donic Crest OFF","Crest OFF"
"potah Donic Desto F3 Big Slam","Desto F3 Big Slam"
"dřevo Donic Elite Carbon","Elite Carbon"
"tričko Donic Fade","Fade"
"stůl Donic Galaxy Outdoor","Galaxy Outdoor"
"polokošile Donic Makro","Makro"
"tričko Donic Nitro","Nitro"
"dřevo Donic Original Dotec OFF","Original Dotec OFF"
"dřevo Donic Original No. 1 Senso","Original No. 1 Senso"
"dřevo Donic Persson Power Carbon Senso V1","Persson Power Carbon Senso V1"
"dřevo Donic Persson Seven","Persson Seven"
"potah Donic Piranja FD Tec","Piranja FD Tec"
"potah Donic Quattro Aconda Soft","Quattro Aconda soft"
"tričko Donic Race Lady","Race Lady"
"polokošile Donic Riva Lady","Riva Lady"
"ponožky Donic Rivoli","Rivoli"
"tričko Donic Sector","Sector"
"potah Donic Twingo","Twingo"
"potah Donic Twingo Plus","Twingo Plus"
"dřevo Donic Waldner Dotec Carbon","Waldner Dotec Carbon"
"dřevo Donic Waldner Legend Carbon","Waldner Legend Carbon"
"dřevo Donic Waldner Senso V2","Waldner Senso V2"
"stůl Donic World Champion TC","World Champion TC"
"potah Dr. Neubauer Aggressor PRO","Aggressor PRO"
"potah Dr. Neubauer Bison+","Bison+"
"potah Dr. Neubauer Desperado Reloaded","Desperado Reloaded"
"potah Dr. Neubauer Killer","Killer"
"potah Dr. Neubauer Tornado Extreme","Tornado Extreme"
"potah Dr. Neubauer Tornado Supreme","Tornado Supreme"
"potah Dr. Neubauer Trouble Maker","Trouble Maker"
"Síťka Giant Dragon Síťka P200","P200"
"Potah JapTec Balance","Balance"
"tričko Joola Ace","Ace"
"bunda Joola Ravenna","Ravenna"
"pálka Joola Rossi Classic","Rossi Classic"
"bunda Joola Squadra","Squadra"
"bunda Joola Summit","Summit"
"kalhoty Joola Summit","Summit"
"bunda Joola Team 14","Team 14"
"kalhoty Joola Team 14","Team 14"
"tričko Joola Torrent Lady","Torrent Lady"
"polokošile Joola ACE","ACE"
"tričko Joola Airform","Airform"
"potah Joola AMY Classic","AMY Classic"
"potah Joola Amy Control","Amy Control"
"šortky Joola Basic 20","Basic 20"
"pálka Joola Beat","Beat"
"košile Joola Centrela","Centrela"
"dřevo Joola Challenger ALL","Challenger ALL"
"dřevo Joola Challenger Carbon","Challenger Carbon"
"dřevo Joola Challenger OFF","Challenger OFF"
"dřevo Joola Chen Weixing DEF+","Chen Weixing DEF+"
"souprava Joola Chilax 22","Chilax 22"
"bunda Joola Chilax Bunda","Chilax"
"kalhoty Joola Chilax Kalhoty","Chilax"
"dřevo Joola Classic Carbon OFF","Classic Carbon OFF"
"čistič Joola Clipper Foam","Clipper Foam"
"síťka Joola Club","Club"
"sportovní oblečení Joola Denon","Denon"
"potah Joola Dynaryz ACC","Dynaryz ACC"
"potah Joola Dynaryz AGR","Dynaryz AGR"
"potah Joola Dynaryz CMD","Dynaryz CMD"
"potah Joola Dynaryz Inferno","Dynaryz Inferno"
"potah Joola Dynaryz ZGR","Dynaryz ZGR"
"potah Joola Dynaryz ZGX","Dynaryz ZGX"
"síťka Joola Easy","Easy"
"tričko Joola Edge Lady","Edge Lady"
"polokošile Joola Edge Polo","Edge Polo"
"potah Joola Express Ultra","Express Ultra"
"vesta Joola Elyon","Elyon"
"potah Joola Golden Tango","Golden Tango"
"potah Joola Golden Tango PS","Golden Tango PS"
"dřevo Joola J Carbon","J Carbon"
"síťka Joola Klick","Klick"
"čepice Joola Joola Trinity","Trinity"
"síťka Joola Libre","Libre"
"šortky Joola Maco","Maco"
"šortky Joola Maco 20","Maco 20"
"míček Joola Magic ABS","Magic ABS"
"potah Joola Maxxx 500","Maxxx 500"
"šortky Joola Meto","Meto"
"potah Joola Micron","Micron"
"stůl Joola Midi Stůl","Midi"
"Mikina Joola Mikina FIT","FIT"
"Mikina Joola Perform","Perform"
"polokošile Joola Milan","Milan"
"stůl Joola Mini Stůl","Mini"
"šortky Joola Mirno","Mirno"
"obuv Joola Nextt 23","NexTT 23"
"síťka Joola Outdoor Síťka","Outdoor"
"Polokošile Joola Plexus Polokošile","Plexus"
"polokošile Joola Polo Airform","Polo Airform"
"Počítadla Joola Result","Result"
"obuv Joola Pro Junior","Pro Junior"
"sportovní souprava Joola Ravenna","Ravenna"
"potah Joola Rhyzen CMD","Rhyzen CMD"
"potah Joola Rhyzen ICE","Rhyzen ICE"
"potah Joola Rhyzen ZGR","Rhyzen ZGR"
"potah Joola Rhyzen ZGX","Rhyzen ZGX"
"dřevo Joola Rossi Junior","Rossi Junior"
"dřevo Joola Rosskopf Emotion","Rosskopf Emotion"
"batoh Joola Alpha","Alpha"
"sběrač míčků Joola Joola Sběrač Míčků",""
"příslušenství Joola Scorpeus","Scorpeus"
"potah Joola Shark","Shark"
"síťka Joola Snapper","Snapper"
"tričko Joola Solstice Lady","Solstice Lady"
"oblečení Joola Summit","Summit"
"souprava Joola Trigon","Trigon"
"síťka Joola Spring","Spring"
"košile Joola Sygma","Sygma"
"bunda Joola Synergy Bunda","Synergy"
"tepláková souprava Joola Synergy","Synergy"
"tričko Joola Syntax Lady","Syntax Lady"
"síťka Joola Joola WM","WM"
"potah Joola Tango Ultra","Tango Ultra"
"sportovní souprava Joola Team 14","Team 14"
"tričko Joola Torrent","Torrent"
"stůl Joola Transport","Transport"
"potah Joola Tronix ACC","Tronix ACC"
"potah Joola Tronix CMD","Tronix CMD"
"potah Joola Tronix ZGR","Tronix ZGR"
"robot Joola Tt-buddy Topspin V100","TT-Buddy Topspin V100"
"robot Joola Tt-buddy V200","TT-Buddy V200"
"Čistič Joola Turbo Cleaner","Turbo cleaner"
"potah Joola Vizon","Vizon"
"dřevo Joola Vyzaryz Hybrid","Vyzaryz Hybrid"
"dřevo Joola Vyzaryz Trinity","Vyzaryz Trinity"
"síťka Joola WM","WM"
"síťka Joola WM Ultra","WM Ultra"
"stůl Joola World Cup 22","World Cup 22"
"Lepidlo Joola X-glue 1000 Ml","X-glue 1000 ml"
"potah Joola Zack","Zack"
"šortky Joola Chilax","Chilax"
"kalhoty Joola Performance","Performance"
"síťka Joola Avanti","Avanti"
"dřevo Joola Chen Defender","Chen Defender"
"dřevo Joola Chen Weixing","Chen Weixing"
"stůl Joola Duomat Pro","Duomat Pro"
"sendvič Joola Express Ultra","Express Ultra"
"Kufřík Joola Kufřík Alu","Alu"
"Kufřík Joola Kufřík Alu Laser","Alu Laser"
"dřevo Joola Nobilis Pbo-c","Nobilis PBO-c"
"dřevo Joola O Allround","O Allround"
"dřevo Joola Offense","Offense"
"síťka Joola Pro Tour","Pro Tour"
"páska Joola Dynaryz","Dynaryz"
"potah Joola Rhyzen Fire","Rhyzen Fire"
"potah Joola Rhyzen Ice","Rhyzen Ice"
"potah Joola Samba","Samba"
"síťovina Joola Spring","Spring"
"sendvič Joola Tango Ultra","Tango Ultra"
"dřevo Joola Xylo 7","Xylo 7"
"Kalhoty Nittaku Action","Action"
"Kalhoty Tibhar Mirage","Mirage"
"Kraťasy Joola Maco","Maco"
"Kraťasy Spinlord Premium","Premium"
"Kraťasy Yasaka Abora","Abora"
"Kufřík Tibhar Alum Cube Point","Alum Cube Point"
"Kufřík Tibhar Alum Cube Premium II","Alum Cube Premium II"
"Lepidlo Andro Turbo Fix","Turbo Fix"
"Lepidlo Victas Bio Fix","Bio Fix"
"Lepidlo Vulcan Champion First","Champion First"
"Lepidlo Vulcan Champion Repeat","Champion Repeat"
"Lepidlo Xiom Energy 200 Ml","Energy 200 ml"
"potah Lion Mantlet","Mantlet"
"láhev Andro Alpha","Alpha"
"Mikina Tibhar Mundo","Mundo"
"Mikina Yasaka Kansas","Kansas"
"Mikina Yasaka Texas","Texas"
"Míčky Andro Zero T***","Zero T***"
"Míčky Andro Zero T","Zero T"
"Míčky DHS DHS **","**"
"Míčky DHS Shield","Shield"
"Míčky Donic Donic ***","***"
"Míčky Joola Prime ***","Prime ***"
"dřevo Nittaku Acoustic","Acoustic"
"potah Nittaku Best Anti","Best Anti"
"potah Nittaku Hammond Z2","Hammond Z2"
"dřevo Nittaku Violin","Violin"
"nůž Tibhar Comfort","Comfort"
"obal na stůl Tibhar PRO","PRO"
"ochranná fólie Andro Energy Cell","Energy Cell"
"ochranná fólie Andro Nuzn","Nuzn"
"ochranná fólie Tibhar Fresh","Fresh"
"ochranná fólie Victas Soft","Soft"
"ochranná páska Andro Colors","Colors"
"páska Andro Colors","Colors"
"ochranná páska Andro Stripes","Stripes"
"ochranná páska Tibhar Classic","Classic"
"páska Tibhar Classic","Classic"
"páska Tibhar Soft","Soft"
"ochranná páska Xiom Logo","Logo"
"ohrádka Andro Basic","Basic"
"ohrádka Victas ESS","ESS"
"katalog Xiom Jekyll & Hyde","Jekyll & Hyde"
"dřevo PimplePark Castro","Castro"
"potah PimplePark Wobbler","Wobbler"
"tričko Joola Centrela","Centrela"
"košile Yasaka Castor","Castor"
"tričko Yasaka Galax","Galax"
"Polokošile Andro Ataxa Women","Ataxa Women"
"polokošile Andro Avos 2023","Avos 2023"
"Polokošile Andro Avos 2024","Avos 2024"
"polokošile Andro Avos Cotton 2023","Avos Cotton 2023"
"tričko Andro Avos Cotton 2024","Avos Cotton 2024"
"tričko Andro Avos Women 2023","Avos Women 2023"
"tričko Andro Avos Women 2024","Avos Women 2024"
"tričko Andro Campell","Campell"
"tričko Andro Devlin","Devlin"
"tričko Andro Harris","Harris"
"tričko Andro Harris Cotton","Harris Cotton"
"tričko Andro Lavor Women","Lavor Women"
"polokošile Andro Letis","Letis"
"tričko Andro Liska","Liska"
"tričko Andro Liska Women","Liska Women"
"tričko Andro Minto","Minto"
"tričko Andro Minto Women","Minto Women"
"tričko Andro Nayton","Nayton"
"tričko Andro Skip","Skip"
"tričko Andro Teslin","Teslin"
"polokošile Andro Tilston","Tilston"
"tričko Butterfly Classic","Classic"
"tričko Butterfly Esk","Esk"
"tričko Butterfly Hero","Hero"
"tričko Butterfly Sydney","Sydney"
"tričko Donic Fusion","Fusion"
"triko Donic Titan","Titan"
"Oblečení Stiga Classic 2","Classic 2"
"tričko Stiga Competition","Competition"
"tričko Tibhar Cube","Cube"
"tričko Tibhar Elite","Elite"
"tričko Tibhar Express","Express"
"tričko Tibhar Fusion","Fusion"
"tričko Tibhar Game PRO","Game PRO"
"triko Tibhar Grip","Grip"
"polokošile Tibhar Line","Line"
"tričko Tibhar Loop","Loop"
"tričko Tibhar Metro Lady","Metro Lady"
"tričko Tibhar Mirage","Mirage"
"polokošile Tibhar Mundo","Mundo"
"tričko Tibhar Tibhar Mundo Cotton","Mundo Cotton"
"polokošile Tibhar Mundo Lady","Mundo Lady"
"tričko Tibhar Osmium","Osmium"
"tričko Tibhar Tibhar Osmium Lady","Osmium Lady"
"tričko Tibhar Primus","Primus"
"polokošile Tibhar Tibhar PRO","PRO"
"tričko Tibhar Pulse","Pulse"
"tričko Tibhar Race Lady","Race Lady"
"polokošile Tibhar Stripe","Stripe"
"tričko Tibhar Techno","Techno"
"tričko Tibhar Terra","Terra"
"tričko Tibhar Trend","Trend"
"polokošile Tibhar Trend Lady","Trend Lady"
"tričko Tibhar Tibhar World","World"
"tričko Tibhar World Cotton","World Cotton"
"tričko Tibhar World Lady","World Lady"
"tričko TSP Kuma","Kuma"
"tričko Xiom Rob","Rob"
"ponožky Andro Alltime","Alltime"
"ponožky Tibhar Basic","Basic"
"ponožky Tibhar Classic Plus","Classic Plus"
"ponožky Tibhar Tech II","Tech II"
"Potah Andro Blowfish+","Blowfish+"
"Potah Andro Good","Good"
"Potah Andro Power 3","Power 3"
"Potah Andro Rasanter C48","Rasanter C48"
"Potah Andro Rasanter C53","Rasanter C53"
"Potah Andro Rasanter R37","Rasanter R37"
"Potah Andro Rasanter R42","Rasanter R42"
"Potah Andro Rasanter R45","Rasanter R45"
"Potah Andro Rasanter R47","Rasanter R47"
"Potah Andro Rasanter R48","Rasanter R48"
"Potah Andro Rasanter R50","Rasanter R50"
"Potah Andro Rasanter R53","Rasanter R53"
"Potah Dr. Neubauer Aggressor EVO","Aggressor EVO"
"Potah Dr. Neubauer Aggressor PRO","Aggressor PRO"
"Potah Dr. Neubauer Buffalo+","Buffalo+"
"Potah Dr. Neubauer Domination","Domination"
"Potah Dr. Neubauer Explosion PRO","Explosion PRO"
"Potah Dr. Neubauer Fighter","Fighter"
"Potah Dr. Neubauer Gorilla","Gorilla"
"Potah Dr. Neubauer Grizzly","Grizzly"
"Potah Dr. Neubauer K.O. PRO","K.O. PRO"
"Potah Dr. Neubauer Killer PRO","Killer PRO"
"Potah Dr. Neubauer Killer PRO EVO","Killer PRO EVO"
"Potah Dr. Neubauer Rhino+","Rhino+"
"Potah Friendship Cross Soft","Cross Soft"
"Potah Palio CK 531 A","CK 531 A"
"Potah Sauer&Troeger Hellfire X","Hellfire X"
"Potah Sauer&Troeger Monkey","Monkey"
"Potah Sauer&Troeger Secret Flow Chop","Secret Flow Chop"
"Potah Spinlord Blitzschlag","Blitzschlag"
"Potah Spinlord Degu","Degu"
"Potah Spinlord Dornenglanz","Dornenglanz"
"Potah Spinlord Spinlord Gigant","Gigant"
"Potah Spinlord Gigant II","Gigant II"
"Potah Spinlord Spinlord Gipfelsturm","Gipfelsturm"
"Potah Spinlord Spinlord Hai","Hai"
"Potah Spinlord Keiler","Keiler"
"Potah Spinlord Spinlord Sandwind","Sandwind"
"Potah Spinlord Stachelfeuer","Stachelfeuer"
"Potah Spinlord Spinlord Strahlkraft","Strahlkraft"
"Potah Spinlord Tiger","Tiger"
"Potah Spinlord Waran","Waran"
"Potah Spinlord Waran II","Waran II"
"Potah Spinlord Spinlord Zeitgeist","Zeitgeist"
"Potah Tibhar Aurus","Aurus"
"Potah Tibhar Aurus Prime","Aurus Prime"
"Potah Tibhar Aurus Select","Aurus Select"
"Potah Tibhar Aurus Soft","Aurus Soft"
"potah Tibhar Tibhar Aurus Soft","Aurus Soft"
"Potah Tibhar Aurus Sound","Aurus Sound"
"Potah Tibhar Evolution EL-D","Evolution EL-D"
"Potah Tibhar Evolution EL-P","Evolution EL-P"
"Potah Tibhar Evolution EL-S","Evolution EL-S"
"Potah Tibhar Evolution FX-D","Evolution FX-D"
"Potah Tibhar Evolution FX-P","Evolution FX-P"
"Potah Tibhar Evolution FX-S","Evolution FX-S"
"Potah Tibhar Evolution MX-D","Evolution MX-D"
"Potah Tibhar Evolution MX-P","Evolution MX-P"
"Potah Tibhar Evolution MX-S","Evolution MX-S"
"Potah Tibhar Genius","Genius"
"Potah Tibhar Genius+ Optimum","Genius+ Optimum"
"Potah Tibhar Grass D.tecs","Grass D.TecS"
"Potah Tibhar Grass D.tecs GS","Grass D.Tecs GS"
"Potah Tibhar Hybrid K1 European Version","Hybrid K1 European version"
"Potah Tibhar Hybrid K3","Hybrid K3"
"Potah Tibhar Hybrid MK","Hybrid MK"
"Potah Tibhar Nimbus","Nimbus"
"Potah Tibhar Nimbus Soft","Nimbus Soft"
"Potah Tibhar Nimbus Sound","Nimbus Sound"
"Potah Tibhar Quantum X PRO","Quantum X PRO"
"Potah Tibhar Rapid","Rapid"
"Potah Tibhar Rapid Soft","Rapid Soft"
"Potah Tibhar Sinus","Sinus"
"Potah Tibhar Sinus Alpha","Sinus Alpha"
"Potah Tibhar Sinus Sound","Sinus Sound"
"Potah Tibhar Speedy Soft D.tecs XD","Speedy Soft D.Tecs XD"
"Potah Tibhar Volcano +","Volcano +"
"Potah Victas Curl P1V","Curl P1V"
"Potah Victas Curl P2V","Curl P2V"
"Potah Victas Curl P3av","Curl P3aV"
"Potah Victas Curl P3V","Curl P3V"
"Potah Victas Curl P4V","Curl P4V"
"Potah Victas Curl P5V","Curl P5V"
"Potah Victas Spectol S1","Spectol S1"
"Potah Victas Spectol S2","Spectol S2"
"Potah Victas Spectol S3","Spectol S3"
"Potah Victas Spinpips D1","Spinpips D1"
"Potah Victas Spinpips D2","Spinpips D2"
"Potah Victas Spinpips D3","Spinpips D3"
"Potah Victas Victas Triple Double Extra","Triple Double Extra"
"Potah Victas Triple Extra","Triple Extra"
"Potah Victas Victas Triple Regular","Triple Regular"
"Potah Victas Victas V > 01","V > 01"
"Potah Victas V > 01 Limber","V > 01 Limber"
"Potah Victas Victas V > 01 Stiff","V > 01 Stiff"
"Potah Victas Victas V > 11 Extra","V > 11 Extra"
"Potah Victas Victas V > 15 Extra","V > 15 Extra"
"Potah Victas V > 15 Limber","V > 15 Limber"
"Potah Victas V > 15 Stiff","V > 15 Stiff"
"Potah Victas V > 20 Double Extra","V > 20 Double Extra"
"Potah Victas Victas V > 22 Double Extra","V > 22 Double Extra"
"Potah Victas Victas Ventus Extra","Ventus Extra"
"Potah Victas Ventus Limber","Ventus Limber"
"Potah Victas Victas Ventus Regular","Ventus Regular"
"Potah Victas Ventus Regular Alpha","Ventus Regular Alpha"
"Potah Victas Ventus Stiff","Ventus Stiff"
"Potah Victas Victas VJ > 07 Limber","VJ > 07 Limber"
"Potah Victas VJ > 07 Regular","VJ > 07 Regular"
"Potah Victas VJ > 07 Stiff","VJ > 07 Stiff"
"Potah Victas VJC > 07 Sticky Extra","VJC > 07 Sticky Extra"
"Potah Victas Victas VLB > 301","VLB > 301"
"Potah Victas Victas VO > 101","VO > 101"
"Potah Victas VO > 102","VO > 102"
"Potah Victas VO > 103","VO > 103"
"Potah Victas VS > 401","VS > 401"
"Potah Victas VS > 402 Double Extra","VS > 402 Double Extra"
"Potah Victas VS > 402 Limber","VS > 402 Limber"
"Potah Xiom Jekyll & Hyde V47.5","Jekyll & Hyde V47.5"
"Potah Xiom Jekyll & Hyde V52.5","Jekyll & Hyde V52.5"
"Potah Xiom Jekyll & Hyde Z52.5","Jekyll & Hyde Z52.5"
"Potah Xiom Omega 7 Asia","Omega 7 Asia"
"Potah Xiom Omega 7 China Guang","Omega 7 China Guang"
"Potah Xiom Omega 7 EU","Omega 7 EU"
"Potah Xiom Omega 7 PRO","Omega 7 PRO"
"Potah Xiom Omega 7 Tour","Omega 7 Tour"
"Potah Xiom Omega IV Asia","Omega IV Asia"
"Potah Xiom Omega IV EU","Omega IV EU"
"Potah Xiom Omega IV PRO","Omega IV PRO"
"Potah Xiom Omega V Asia DF","Omega V Asia DF"
"Potah Xiom Omega V EU DF","Omega V EU DF"
"Potah Xiom Omega V PRO","Omega V PRO"
"Potah Xiom Omega V Tour DF","Omega V Tour DF"
"Potah Xiom Vega Asia","Vega Asia"
"Potah Xiom Vega Asia DF","Vega Asia DF"
"Potah Xiom Vega Elite","Vega Elite"
"Potah Xiom Vega EU","Vega EU"
"Potah Xiom Vega EU DF","Vega EU DF"
"Potah Xiom Vega Intro","Vega Intro"
"Potah Xiom Vega Japan","Vega Japan"
"Potah Xiom Vega PRO","Vega PRO"
"Potah Xiom Vega Tour","Vega Tour"
"Potah Xiom Vega X","Vega X"
"Potah Yasaka Rakza 7","Rakza 7"
"Potah Yasaka Rakza 7 Soft","Rakza 7 Soft"
"potítko Andro New Alpha","New Alpha"
"potítko Tibhar Evolution L","Evolution L"
"potítko Tibhar Evolution S","Evolution S"
"potítko Tibhar Tibhar L 2021","L 2021"
"potítko Tibhar S 2021","S 2021"
"Pouzdro Andro Fraser Camouflage Double","Fraser Camouflage Double"
"Pouzdro Andro Maboon Basic","Maboon Basic"
"Pouzdro Andro Maboon Double","Maboon Double"
"Pouzdro Andro Sintra Double","Sintra Double"
"Pouzdro Tibhar Carbon Round","Carbon Round"
"Pouzdro Tibhar Hong Kong Double","Hong Kong Double"
"Pouzdro Tibhar Hong Kong Round S Kapsou","Hong Kong Round s kapsou"
"Pouzdro Tibhar Macao Double","Macao Double"
"Pouzdro Tibhar Macao Single","Macao Single"
"Pouzdro Tibhar T Double","T Double"
"Pouzdro Tibhar T Round","T Round"
"Pouzdro Tibhar Tibhar T Round S Kapsou","T Round s kapsou"
"Pouzdro Tibhar Tibhar T Single","T Single"
"Počítadla Andro Fair Play","Fair Play"
"Počítadla Tibhar Point Counter","Point Counter"
"Počítadla Tibhar Smash","Smash"
"Počítadla Tibhar Time Out","Time Out"
"Potah Andro Bype","Bype"
"Potah Andro Bype SFX","Bype SFX"
"Potah Andro Hexer Pips Force","Hexer Pips Force"
"Potah Andro Hexer Pips+","Hexer Pips+"
"Potah Butterfly Bryce Highspeed","Bryce Highspeed"
"Potah Butterfly Challenger Attack","Challenger Attack"
"Potah Butterfly Dignics 05","Dignics 05"
"Potah Butterfly Dignics 09C","Dignics 09C"
"Potah Butterfly Dignics 64","Dignics 64"
"Potah Butterfly Feint Long II","Feint Long II"
"Potah Butterfly Glayzer","Glayzer"
"Potah Butterfly Glayzer 09C","Glayzer 09C"
"Potah Butterfly Sriver","Sriver"
"Potah Butterfly Sriver FX","Sriver FX"
"Potah Butterfly Super Anti","Super Anti"
"Potah Butterfly Tenergy 05","Tenergy 05"
"Potah Butterfly Tenergy 05 FX","Tenergy 05 FX"
"Potah Butterfly Tenergy 64","Tenergy 64"
"Potah Butterfly Tenergy 64 FX","Tenergy 64 FX"
"Potah Butterfly Tenergy 80","Tenergy 80"
"Potah Butterfly Tenergy 80 FX","Tenergy 80 FX"
"Potah Der Materialspezialist Master Anti","Master Anti"
"Potah Der Materialspezialist Mega-block","Mega-Block"
"Potah Lion Rebellion","Rebellion"
"Potah Der Materialspezialist Tenacious Violence Speed","Tenacious Violence Speed"
"Potah Der Materialspezialist Transformer","Transformer"
"Potah DHS Hurricane 2","Hurricane 2"
"Potah DHS Hurricane 2 Neo","Hurricane 2 Neo"
"Potah DHS Hurricane 3","Hurricane 3"
