"KEY","VALUE"
"Dřevo Der Materialspezialist Protector","Protector"
"Dřevo Der Materialspezialist Scooper OFF","Scooper OFF"
"Dřevo Der Materialspezialist Terror","Terror"
"Dřevo Der Materialspezialist Wizard Fire","Wizard Fire"
"Lepidlo Der Materialspezialist Contact Premium Plus","Contact Premium Plus"
"potah Der Materialspezialist Diabolic Special","Diabolic Special"
"potah Der Materialspezialist Elite Long","Elite long"
"potah Der Materialspezialist Reflection","Reflection"
"potah Der Materialspezialist Spinfire Soft","Spinfire Soft"
"potah Der Materialspezialist Storkraft","Storkraft"
"Potah DHS PF4","PF4"
"Dřevo DHS Hurricane Long 5","Hurricane Long 5"
"míček DHS DHS Dual D40+","Dual D40+"
"míček DHS DHS Dual D40+ *","Dual D40+ *"
"potah DHS Hurricane 3","Hurricane 3"
"potah DHS Hurricane 3 Neo","Hurricane 3 Neo"
"potah DHS Skyline 3 Neo","Skyline 3 Neo"
"sportovní oblečení Donic Paddox","Paddox"
"sportovní oblečení Donic Donic Capri","Capri"
"Míčky Donic Donic P40+ ***","P40+ ***"
"Potah Donic Acuda S1","Acuda S1"
"Potah Donic Acuda S1 Turbo","Acuda S1 Turbo"
"Potah Donic Acuda S2","Acuda S2"
"Potah Donic Donic Acuda S3","Acuda S3"
"Potah Donic Acuda S3","Acuda S3"
"Potah Donic Akkadi Taichi","Akkadi Taichi"
"Potah Donic Alligator Anti","Alligator Anti"
"Potah Donic Alligator DEF","Alligator DEF"
"Potah Donic Baracuda Big Slam","Baracuda Big Slam"
"Potah Donic Baracuda","Baracuda"
"Potah Donic Baxster F1-A","Baxster F1-A"
"Potah Donic Bluefire M1","Bluefire M1"
"Potah Donic Bluefire M1 Turbo","Bluefire M1 Turbo"
"Potah Donic Bluefire M2","Bluefire M2"
"Potah Donic Bluefire M3","Bluefire M3"
"Potah Donic Bluegrip C1","BlueGrip C1"
"Potah Donic Bluegrip C2","BlueGrip C2"
"Potah Donic Bluegrip S1","BlueGrip S1"
"Potah Donic Bluegrip S2","BlueGrip S2"
"Potah Donic Bluestar A1","Bluestar A1"
"Potah Donic Bluestar A2","Bluestar A2"
"Potah Donic Bluestar A3","Bluestar A3"
"Potah Donic Bluestorm Big Slam","Bluestorm Big Slam"
"Potah Donic Bluestorm Pro AM","Bluestorm Pro AM"
"Potah Donic Bluestorm Pro","Bluestorm Pro"
"Potah Donic Bluestorm Z1","Bluestorm Z1"
"Potah Donic Bluestorm Z1 Turbo","Bluestorm Z1 Turbo"
"Potah Donic Bluestorm Z2","Bluestorm Z2"
"Potah Donic Bluestorm Z3","Bluestorm Z3"
"Potah Donic Coppa","Coppa"
"Potah Donic Coppa Tenero","Coppa Tenero"
"Potah Donic Donic Coppa Tenero","Coppa Tenero"
"Potah Donic Donic Coppa X1 Gold","Coppa X1 Gold"
"Potah Donic Coppa X1 Gold","Coppa X1 Gold"
"Potah Donic Coppa X1 Turbo Platin","Coppa X1 Turbo Platin"
"Potah Donic Coppa X2 Platin Soft","Coppa X2 Platin Soft"
"Potah Donic Coppa X3 Silver","Coppa X3 Silver"
"Potah Donic Desto F1","Desto F1"
"Potah Donic Desto F1 Plus","Desto F1 Plus"
"Potah Donic Desto F2","Desto F2"
"Potah Donic Desto F3","Desto F3"
"Potah Donic Desto F4","Desto F4"
"Potah Donic Liga Plus","Liga Plus"
"Potah Donic Liga","Liga"
"Potah Donic Piranja CD","Piranja CD"
"Potah Donic Quattro Aconda Soft","Quattro Aconda Soft"
"Potah Donic Quattro","Quattro"
"Potah Donic Donic Quattro","Quattro"
"Potah Donic Sonex JP Gold","Sonex JP Gold"
"Potah Donic Spike P2","Spike P2"
"Potah Donic Twingo Plus","Twingo Plus"
"Potah Donic Twingo","Twingo"
"Potah Donic Vario Big Slam","Vario Big Slam"
"Potah Donic Vario","Vario"
"Potah Donic Vario Soft","Vario Soft"
"Polokošile Donic Aviator","Aviator"
"Polokošile Donic Flow Lady","Flow Lady"
"Dřevo Donic Alligator Combi","Alligator Combi"
"Dřevo Donic Anders Lind Hexa Carbon","Anders Lind Hexa Carbon"
"Dřevo Donic Appelgren Allplay","Appelgren Allplay"
"Dřevo Donic Appelgren Allplay Senso V1","Appelgren Allplay Senso V1"
"Dřevo Donic Donic Appelgren Allplay Senso V2","Appelgren Allplay Senso V2"
"Dřevo Donic Appelgren Allplay Senso V2","Appelgren Allplay Senso V2"
"Dřevo Donic Appelgren Exclusive AR","Appelgren Exclusive AR"
"Dřevo Donic Balsa Carbo Certran","Balsa Carbo Certran"
"Dřevo Donic Burn ALL+","Burn ALL+"
"Dřevo Donic Donic Burn OFF","Burn OFF"
"Dřevo Donic Burn OFF","Burn OFF"
"Dřevo Donic Donic Burn OFF-","Burn OFF-"
"Dřevo Donic Burn OFF-","Burn OFF-"
"Dřevo Donic Donic Classic Allround","Classic Allround"
"Dřevo Donic Donic Classic Power Allround","Classic Power Allround"
"Dřevo Donic Classic Power Allround","Classic Power Allround"
"Dřevo Donic Defplay Classic Senso","Defplay Classic Senso"
"Dřevo Donic Defplay Inner Carbon","Defplay Inner Carbon"
"Dřevo Donic Defplay Senso","Defplay Senso"
"Dřevo Donic Donic Elite Carbon","Elite Carbon"
"Dřevo Donic Epox Control","Epox Control"
"Dřevo Donic Epox Topspeed","Epox Topspeed"
"Dřevo Donic Esprit","Esprit"
"Dřevo Donic J.O. Waldner Gold Edition","J.O. Waldner Gold Edition"
"Dřevo Donic Donic New Impuls 6.5","New Impuls 6.5"
"Dřevo Donic Donic New Impuls 7.0","New Impuls 7.0"
"Dřevo Donic New Impuls 7.0","New Impuls 7.0"
"Dřevo Donic Donic New Impuls 7.5","New Impuls 7.5"
"Dřevo Donic Original Carbospeed","Original Carbospeed"
"Dřevo Donic Original Exclusive Carbon","Original Exclusive Carbon"
"Dřevo Donic Original Senso V2","Original Senso V2"
"Dřevo Donic Donic Original True Carbon Inner","Original True Carbon Inner"
"Dřevo Donic Original True Carbon Inner","Original True Carbon Inner"
"Dřevo Donic Donic Persson Exclusive OFF","Persson Exclusive OFF"
"Dřevo Donic Persson Exclusive OFF","Persson Exclusive OFF"
"Dřevo Donic Persson OFF+ World Champion 89","Persson OFF+ World Champion 89"
"Dřevo Donic Persson Power Allround","Persson Power Allround"
"Dřevo Donic Persson Power AR Senso V1","Persson Power AR Senso V1"
"Dřevo Donic Persson Power AR Senso V2","Persson Power AR Senso V2"
"Dřevo Donic Persson Power Carbon Senso V1","Persson Power Carbon Senso V1"
"Dřevo Donic Persson Powerplay","Persson Powerplay"
"Dřevo Donic Persson Powerplay Senso V1","Persson Powerplay Senso V1"
"Dřevo Donic Donic Persson Powerplay Senso V1","Persson Powerplay Senso V1"
"Dřevo Donic Persson Powerplay Senso V2","Persson Powerplay Senso V2"
"Dřevo Donic Persson Seven","Persson Seven"
"Dřevo Donic Donic Relevant","Relevant"
"Dřevo Donic Waldner Allplay","Waldner Allplay"
"Dřevo Donic Waldner Black Devil CB","Waldner Black Devil CB"
"Dřevo Donic Waldner Dicon","Waldner Dicon"
"Dřevo Donic Waldner Exclusive AR+","Waldner Exclusive AR+"
"Dřevo Donic Waldner Legend Carbon","Waldner Legend Carbon"
"Dřevo Donic Waldner OFF World Champion 89","Waldner OFF World Champion 89"
"Dřevo Donic Waldner Senso Carbon","Waldner Senso Carbon"
"Dřevo Donic Waldner Senso Ultra Carbon","Waldner Senso Ultra Carbon"
"Dřevo Donic Waldner Senso V1","Waldner Senso V1"
"Dřevo Donic Waldner Senso V2","Waldner Senso V2"
"Dřevo Donic WX Dotec Control Plus","WX Dotec Control Plus"
"Lepidlo Donic Blue Contact","Blue Contact"
"Lepidlo Donic Contact Pro","Contact Pro"
"Lepidlo Donic Formula Pro","Formula Pro"
"příslušenství Donic Robo-caddy","Robo-Caddy"
"příslušenství Donic Rollerbox","Rollerbox"
"boty Donic Spaceflex","Spaceflex"
"obuv Donic Donic Spaceflex","Spaceflex"
"boty Donic Donic Spaceflex","Spaceflex"
"Kraťasy Donic Beam","Beam"
"Kraťasy Donic React","React"
"Triko Donic Atlas","Atlas"
"Triko Donic Dragon","Dragon"
"Triko Donic T-shirt Lion","T-Shirt"
"Triko Donic Slate","Slate"
"Stůl Donic Delhi SLC","Delhi SLC"
"Stůl Donic World Champion TC","World Champion TC"
"potah Donic Acuda Blue P2","Acuda Blue P2"
"tričko Donic Agile","Agile"
"polokošile Donic Air","Air"
"polokošile Donic Airflex","Airflex"
"potah Donic Alligator Def","Alligator Def"
"dřevo Donic Anders Lind Hexa Carbon","Anders Lind Hexa Carbon"
"dřevo Donic Appelgren Allplay Senso V1","Appelgren Allplay Senso V1"
"dřevo Donic Appelgren Allplay Senso V2","Appelgren Allplay Senso V2"
"dřevo Donic Appelgren Dotec Control","Appelgren Dotec Control"
"tričko Donic Argon","Argon"
"polokošile Donic Aviator","Aviator"
"dřevo Donic Balsa Carbo Certran","Balsa Carbo Certran"
"šortky Donic Basic","Basic"
"Batoh Donic Batoh Nova","Nova"
"potah Donic Baxster F1-A","Baxster F1-A"
"šortky Donic Beam","Beam"
"čistič potahů Donic Bioclean","Bioclean"
"polokošile Donic Blitz","Blitz"
"tričko Donic Blitz Lady","Blitz Lady"
"potah Donic Bluefire JP 01 Turbo","Bluefire JP 01 Turbo"
"potah Donic Bluestar A2","Bluestar A2"
"potah Donic Bluestar A3","Bluestar A3"
"potah Donic Bluestorm Big Slam","Bluestorm Big Slam"
"dřevo Donic Burn OFF","Burn OFF"
"polokošile Donic Caliber","Caliber"
"tričko Donic Caliber Lady","Caliber Lady"
"polokošile Donic Clash","Clash"
"tričko Donic Clash Lady","Clash Lady"
"polokošile Donic Clashflex","Clashflex"
"pouzdro Donic Classic","Classic"
"dřevo Donic Classic Power Allround","Classic Power Allround"
"tričko Donic Clix","Clix"
"míčky Donic Coach P40+","Coach P40+"
"tričko Donic Columbia","Columbia"
"čistič potahu Donic Combi Cleaner","Combi Cleaner"
"pouzdro Donic Comp","Comp"
"lepidlo Donic Contact Pro","Contact Pro"
"potah Donic Coppa X1 Turbo Platin","Coppa X1 Turbo Platin"
"kalhoty Donic Craft Kalhoty","Craft"
"dřevo Donic Defplay Classic Senso","Defplay Classic Senso"
"dřevo Donic Defplay Senso","Defplay Senso"
"stůl Donic Delhi SLC","Delhi SLC"
"šortky Donic Dive","Dive"
"polokošile Donic Draftflex","Draftflex"
"tričko Donic Dragon","Dragon"
"tričko Donic Drop","Drop"
"pouzdro Donic Duplex","Duplex"
"polokošile Donic Effect","Effect"
"dřevo Donic Epox Control","Epox Control"
"dřevo Donic Epox OFF","Epox OFF"
"dřevo Donic Epox Power AR","Epox Power AR"
"ponožky Donic Etna","Etna"
"šortky Donic Finish","Finish"
"polokošile Donic Flame","Flame"
"tričko Donic Flame Lady","Flame Lady"
"síťka Donic Flex","Flex"
"polokošile Donic Flow","Flow"
"tričko Donic Flow Lady","Flow Lady"
"polokošile Donic Force","Force"
"lepidlo Donic Formula Pro","Formula Pro"
"bunda Donic Fuse","Fuse"
"kalhoty Donic Fuse Kalhoty","Fuse"
"taška Donic Gamble","Gamble"
"pouzdro Donic Ginger","Ginger"
"pouzdro Donic Hardcase","Hardcase"
"kalhoty Donic Heat Kalhoty","Heat"
"taška Donic Helium","Helium"
"kalhoty Donic Hype Kalhoty","Hype"
"dřevo Donic Impuls Dotec ALL+","Impuls Dotec ALL+"
"sukně Donic Irion","Irion"
"dřevo Donic J.O. Waldner Gold Edition","J.O. Waldner Gold Edition"
"Kufřík Donic Kufřík Aluminium","Aluminium"
"Kufřík Donic Kufřík Double Alu","Double Alu"
"pouzdro Donic Legends","Legends"
"polokošile Donic Libra","Libra"
"polokošile Donic Libra Lady","Libra Lady"
"potah Donic Liga","Liga"
"potah Donic Liga Plus","Liga Plus"
"šortky Donic Limit","Limit"
"šortky Donic Loop","Loop"
"bunda Donic Louisiana","Louisiana"
"kalhoty Donic Louisiana","Louisiana"
"pouzdro Donic Luna","Luna"
"pouzdro na pálku Donic Lux","Lux"
"polokošile Donic Makroflex","Makroflex"
"polokošile Donic Manic","Manic"
"tričko Donic Mega","Mega"
"tričko Donic Mirage","Mirage"
"dřevo Donic New Impuls 6.5","New Impuls 6.5"
"dřevo Donic New Impuls 7.0","New Impuls 7.0"
"dřevo Donic New Impuls 7.5","New Impuls 7.5"
"tričko Donic Nitro Lady","Nitro Lady"
"polokošile Donic Nitroflex","Nitroflex"
"tričko Donic Nova","Nova"
"dřevo Donic Original Dotec ALL","Original Dotec ALL"
"dřevo Donic Original Dotec ALL+","Original Dotec ALL+"
"dřevo Donic Original Exclusive Carbon","Original Exclusive Carbon"
"dřevo Donic Original No. 1","Original No. 1"
"dřevo Donic Original Senso V2","Original Senso V2"
"dřevo Donic Original True Carbon Inner","Original True Carbon Inner"
"stůl Donic Outdoor Roller 1000","Outdoor Roller 1000"
"stůl Donic Outdoor Roller 800-5","Outdoor Roller 800-5"
"dřevo Donic Ovtcharov No. 1","Ovtcharov No. 1"
"míček Donic P40+ ***","P40+ ***"
"míčky Donic P40+ ***","P40+ ***"
"bunda Donic Paddox","Paddox"
"kalhoty Donic Paddox Kalhoty","Paddox"
"tričko Donic Peak","Peak"
"pouzdro Donic Persson","Persson"
"dřevo Donic Persson OFF+ World Champion 89","Persson OFF+ World Champion 89"
"dřevo Donic Persson Power Allround","Persson Power Allround"
"dřevo Donic Persson Power AR Senso V1","Persson Power AR Senso V1"
"dřevo Donic Persson Power AR Senso V2","Persson Power AR Senso V2"
"dřevo Donic Persson Powerplay","Persson Powerplay"
"dřevo Donic Persson Powerplay Senso V1","Persson Powerplay Senso V1"
"dřevo Donic Persson Powerplay Senso V2","Persson Powerplay Senso V2"
"dřevo Donic Persson Youngstar","Persson Youngstar"
"pouzdro Donic Pop","Pop"
"polokošile Donic Prime","Prime"
"tričko Donic Primeflex","Primeflex"
"bunda Donic Prisma","Prisma"
"kalhoty Donic Prisma Kalhoty","Prisma"
"šortky Donic Pulse","Pulse"
"polokošile Donic Push","Push"
"potah Donic Quattro Aconda Medium","Quattro Aconda medium"
"polokošile Donic Race","Race"
"tričko Donic Raceflex","Raceflex"
"polokošile Donic Rafter","Rafter"
"tričko Donic Rafter Lady","Rafter Lady"
"taška Donic Revox","Revox"
"tričko Donic Riva","Riva"
"pouzdro Donic Rooster","Rooster"
"ručník Donic Scan","Scan"
"tričko Donic Sentry","Sentry"
"taška Donic Sequence","Sequence"
"ponožky Donic Siena","Siena"
"pouzdro na pálku Donic Simplex","Simplex"
"dřevo Donic Skachkov Carbon","Skachkov Carbon"
"tričko Donic Slate","Slate"
"polokošile Donic Splash","Splash"
"polokošile Donic Splashflex","Splashflex"
"tričko Donic Split","Split"
"šortky Donic Sprint","Sprint"
"tričko Donic Static","Static"
"tričko Donic Sting","Sting"
"tričko Donic Stunner","Stunner"
"taška Donic Tense","Tense"
"tričko Donic Tiger","Tiger"
"bunda Donic Trip","Trip"
"tričko Donic Tropic","Tropic"
"boty Donic Ultra Power","Ultra Power"
"obuv Donic Ultra Power III","Ultra Power III"
"lepidlo Donic Vario Clean","Vario Clean"
"taška Donic Vertical","Vertical"
"ponožky Donic Vesuvio","Vesuvio"
"pouzdro Donic Waldner","Waldner"
"dřevo Donic Waldner Black Devil CB","Waldner Black Devil CB"
"dřevo Donic Waldner Dicon","Waldner Dicon"
"dřevo Donic Waldner Dotec AR","Waldner Dotec AR"
"dřevo Donic Waldner OFF World Champion 89","Waldner OFF World Champion 89"
"stůl Donic Waldner SC","Waldner SC"
"dřevo Donic Waldner Senso Carbon","Waldner Senso Carbon"
"dřevo Donic Waldner Senso Ultra Carbon","Waldner Senso Ultra Carbon"
"dřevo Donic Waldner Senso V1","Waldner Senso V1"
"dřevo Donic Waldner Youngstar","Waldner Youngstar"
"dřevo Donic Whiper Inner Carbon","Whiper Inner Carbon"
"dřevo Donic Whiper Outer Carbon","Whiper Outer Carbon"
"Potah Dr. Neubauer Aggressor Evo","Aggressor Evo"
"Potah Dr. Neubauer Aggressor Pro","Aggressor Pro"
"Potah Dr. Neubauer Aggressor","Aggressor"
"Potah Dr. Neubauer Allround Premium 2","Allround Premium 2"
"Potah Dr. Neubauer Anti Special","Anti Special"
"Potah Dr. Neubauer Bison+","Bison+"
"Potah Dr. Neubauer Boomerang Classic","Boomerang Classic"
"Potah Dr. Neubauer Buffalo","Buffalo"
"Potah Dr. Neubauer Defence Master","Defence Master"
"Potah Dr. Neubauer Desperado 2","Desperado 2"
"Potah Dr. Neubauer Desperado","Desperado"
"Potah Dr. Neubauer Diamant","Diamant"
"Potah Dr. Neubauer Django","Django"
"Potah Dr. Neubauer Dominance","Dominance"
"Potah Dr. Neubauer Dominance Speed","Dominance Speed"
"Potah Dr. Neubauer Dominance Spin Hard","Dominance Spin Hard"
"Potah Dr. Neubauer Dominance Spin","Dominance Spin"
"Potah Dr. Neubauer Domination Speed 2","Domination Speed 2"
"Potah Dr. Neubauer Domination Speed Soft","Domination Speed Soft"
"Potah Dr. Neubauer Explosion Extreme","Explosion Extreme"
"Potah Dr. Neubauer Explosion Pro","Explosion Pro"
"Potah Dr. Neubauer Explosion","Explosion"
"Potah Dr. Neubauer Explosion Soft","Explosion Soft"
"Potah Dr. Neubauer Gangster","Gangster"
"Potah Dr. Neubauer K.O. Extreme","K.O. Extreme"
"Potah Dr. Neubauer K.O. Pro","K.O. Pro"
"Potah Dr. Neubauer Killer","Killer"
"Potah Dr. Neubauer Killer Pro Evo","Killer Pro Evo"
"Potah Dr. Neubauer Killer Pro","Killer Pro"
"Potah Dr. Neubauer Killer Soft","Killer Soft"
"Potah Dr. Neubauer Leopard","Leopard"
"Potah Dr. Neubauer Monster Classic","Monster Classic"
"Potah Dr. Neubauer Nugget","Nugget"
"Potah Dr. Neubauer Number 1","Number 1"
"Potah Dr. Neubauer Dr. Neubauer Number 1","Number 1"
"Potah Dr. Neubauer Pistol 2","Pistol 2"
"Potah Dr. Neubauer Pistol","Pistol"
"Potah Dr. Neubauer Power Attack","Power Attack"
"Potah Dr. Neubauer Punch","Punch"
"Potah Dr. Neubauer Special Defence","Special Defence"
"Potah Dr. Neubauer Terminator","Terminator"
"Potah Dr. Neubauer Tornado Extreme","Tornado Extreme"
"Potah Dr. Neubauer Tornado Supreme","Tornado Supreme"
"Potah Dr. Neubauer Tornado Supreme Soft","Tornado Supreme Soft"
"Potah Dr. Neubauer Tornado Ultra","Tornado Ultra"
"Potah Dr. Neubauer Trouble Maker","Trouble Maker"
"Potah Dr. Neubauer Viper","Viper"
"Potah Dr. Neubauer Viper Soft","Viper Soft"
"Dřevo Dr. Neubauer Barricade DEF","Barricade DEF"
"Dřevo Dr. Neubauer Bloodhound","Bloodhound"
"Dřevo Dr. Neubauer Bloodhound ALL+","Bloodhound ALL+"
"Dřevo Dr. Neubauer Bulldog","Bulldog"
"Dřevo Dr. Neubauer Firewall Plus","Firewall Plus"
"Dřevo Dr. Neubauer Gladiator","Gladiator"
"Dřevo Dr. Neubauer Grand Master","Grand Master"
"Dřevo Dr. Neubauer High Tech Cypress Carbon","High Tech Cypress Carbon"
"Dřevo Dr. Neubauer High Technology Plus","High Technology Plus"
"Dřevo Dr. Neubauer Jackpot","Jackpot"
"Dřevo Dr. Neubauer Kung Fu","Kung Fu"
"Dřevo Dr. Neubauer Magical Touch","Magical Touch"
"Dřevo Dr. Neubauer Matador","Matador"
"Dřevo Dr. Neubauer Matador Texa","Matador Texa"
"Dřevo Dr. Neubauer Matador Texa Balsa","Matador Texa Balsa"
"Dřevo Dr. Neubauer Matador Texa Carbon","Matador Texa Carbon"
"Dřevo Dr. Neubauer Phenomenon","Phenomenon"
"Dřevo Dr. Neubauer Titan","Titan"
"Dřevo Dr. Neubauer World Champion","World Champion"
"Dřevo Dr. Neubauer World Champion Carbon","World Champion Carbon"
"potah Dr. Neubauer Allround Premium","Allround Premium"
"potah Dr. Neubauer Allround Premium 2","Allround Premium 2"
"potah Dr. Neubauer Anti Special","Anti Special"
"potah Dr. Neubauer Bison","Bison"
"potah Dr. Neubauer Buffalo+","Buffalo+"
"potah Dr. Neubauer Desperado","Desperado"
"potah Dr. Neubauer Desperado 2","Desperado 2"
"potah Dr. Neubauer Dr. Neubauer Django","Django"
"potah Dr. Neubauer Domination","Domination"
"potah Dr. Neubauer Domination Speed","Domination Speed"
"potah Dr. Neubauer Explosion","Explosion"
"potah Dr. Neubauer Gangster","Gangster"
"potah Dr. Neubauer Gorilla","Gorilla"
"potah Dr. Neubauer Grizzly","Grizzly"
"potah Dr. Neubauer K.O.","K.O."
"potah Dr. Neubauer K.O. Extreme","K.O. Extreme"
"potah Dr. Neubauer K.O. Pro","K.O. Pro"
"potah Dr. Neubauer Killer Extreme","Killer Extreme"
"potah Dr. Neubauer Killer Pro","Killer Pro"
"potah Dr. Neubauer Killer Pro EVO","Killer pro EVO"
"potah Dr. Neubauer Killer Soft","Killer Soft"
"potah Dr. Neubauer Monster Classic","Monster Classic"
"potah Dr. Neubauer Pistol","Pistol"
"potah Dr. Neubauer Pistol 2","Pistol 2"
"potah Dr. Neubauer Rhino","Rhino"
"potah Dr. Neubauer Rhino+","Rhino+"
"potah Dr. Neubauer Terminator","Terminator"
"potah Dr. Neubauer Tornado Supreme Soft","Tornado Supreme Soft"
"sendvič Dr. Neubauer Tornado Ultra","Tornado Ultra"
"potah Dr. Neubauer Viper","Viper"
"potah Dr. Neubauer Viper Soft","Viper Soft"
"tričko Joola Solstice","Solstice"
"tričko Yasaka Callisto","Callisto"
"dres Yasaka Galax","Galax"
"dres Yasaka Vega","Vega"
"Dřevo Andro Gauzy BL5","Gauzy BL5"
"Dřevo Andro Gauzy HL CO","Gauzy HL CO"
"Dřevo Andro Andro Kanter FO OFF","Kanter FO OFF"
"Dřevo Andro Novacell OFF","Novacell OFF"
"Dřevo Andro Timber 5 All/s","Timber 5 ALL/S"
"Dřevo Andro Timber 5 DEF","Timber 5 DEF"
"Dřevo Andro Timber 5 OFF","Timber 5 OFF"
"Dřevo Andro Timber 7 OFF","Timber 7 OFF"
"Dřevo Andro Timber 7 Off/s","Timber 7 OFF/S"
"Dřevo Andro TP Ligna ALL","TP Ligna ALL"
"Dřevo Andro TP Ligna CI","TP Ligna CI"
"Dřevo Andro TP Ligna CO","TP Ligna CO"
"Dřevo Andro Treiber FI","Treiber FI"
"Dřevo Andro Wanokiwami AO OFF","Wanokiwami AO OFF"
"Dřevo Andro Wanokiwami Midori","Wanokiwami Midori"
"Dřevo Andro Wanokiwami REN","Wanokiwami REN"
"Dřevo Der Materialspezialist Blockbuster","Blockbuster"
"Dřevo Der Materialspezialist Defensor","Defensor"
"Dřevo Der Materialspezialist Dr. Jekyll & Mr. Hyde","Dr. Jekyll & Mr. Hyde"
"Dřevo Der Materialspezialist Power Control","Power Control"
"Dřevo Der Materialspezialist Revolution","Revolution"
"Dřevo Der Materialspezialist Scooper DEF","Scooper DEF"
"Dřevo Der Materialspezialist The Wall","The Wall"
"Dřevo Der Materialspezialist Trouble","Trouble"
"Dřevo Der Materialspezialist Wizard","Wizard"
"Dřevo DHS DHS Fang Bo","Fang Bo"
"Dřevo DHS Hurricane Hao","Hurricane Hao"
"Dřevo DHS Hurricane Hao 2","Hurricane Hao 2"
"Dřevo DHS Hurricane Hao 3","Hurricane Hao 3"
"Dřevo DHS Hurricane Long 3","Hurricane Long 3"
"Dřevo Donic Burn Off","Burn Off"
"Dřevo Donic Classic Allround","Classic Allround"
"Dřevo Donic Classic Offensive","Classic Offensive"
"Dřevo Donic Donic Esprit","Esprit"
"Dřevo Donic Donic Original No. 1","Original No. 1"
"Dřevo Donic Donic Original No. 1 Senso","Original No. 1 Senso"
"Dřevo Donic Original Senso Carbon","Original Senso Carbon"
"Dřevo Donic Donic Original Senso V2","Original Senso V2"
"Dřevo Donic Original True Carbon","Original True Carbon"
"Dřevo Donic Donic Persson Seven","Persson Seven"
"Dřevo Donic Persson Youngstar","Persson Youngstar"
"Dřevo Donic Waldner Offensive","Waldner Offensive"
"Dřevo Donic Waldner Youngstar","Waldner Youngstar"
"Dřevo Donic Xtreme","Xtreme"
"Dřevo Joola Challenger ALL","Challenger ALL"
"Dřevo Joola Challenger Carbon","Challenger Carbon"
"Dřevo Joola Challenger OFF","Challenger OFF"
"Dřevo Joola Nobilis Pbo-c","Nobilis PBO-c"
"Dřevo Joola Rosskopf Allround","Rosskopf Allround"
"Dřevo Joola Santoru 3k-c","Santoru 3K-c"
"Dřevo Joola Santoru KL-C Inner","Santoru KL-C Inner"
"Dřevo Joola Santoru KL-C Outer","Santoru KL-C Outer"
"Dřevo Joola Tezzo Guardian","Tezzo Guardian"
"Dřevo Joola Tezzo Paladin","Tezzo Paladin"
"Dřevo Joola Tezzo Spartan","Tezzo Spartan"
"Dřevo Joola Tezzo Warrior","Tezzo Warrior"
"Dřevo Joola Vyzaryz Freeze HRD","Vyzaryz Freeze HRD"
"Dřevo Joola Vyzaryz Trinity","Vyzaryz Trinity"
"Dřevo Joola Xylo 7","Xylo 7"
"Dřevo Nittaku Acoustic","Acoustic"
"Dřevo Nittaku Violin","Violin"
"Dřevo Sauer&Troeger Firestarter","Firestarter"
"Dřevo Sauer&Troeger Kasalla","Kasalla"
"Dřevo Sauer&Troeger Zeus","Zeus"
"Dřevo Tibhar Tibhar Allround Classic","Allround Classic"
"Dřevo Tibhar Balsa Fibre OFF 60","Balsa Fibre OFF 60"
"Dřevo Tibhar Balsa Fibretec 75","Balsa Fibretec 75"
"Dřevo Tibhar Defense Plus","Defense Plus"
"Dřevo Tibhar Dynamic J7","Dynamic J7"
"Dřevo Tibhar Dynamic JC","Dynamic JC"
"Dřevo Tibhar Fortino Force","Fortino Force"
"Dřevo Tibhar Fortino Performance","Fortino Performance"
"Dřevo Tibhar Fortino PRO","Fortino PRO"
"Dřevo Tibhar Kinetic Speed","Kinetic Speed"
"Dřevo Tibhar Tibhar Kratos","Kratos"
"Dřevo Tibhar Li Qian","Li Qian"
"Dřevo Tibhar Libra ZAC","Libra ZAC"
"Dřevo Tibhar MK 7","MK 7"
"Dřevo Tibhar Nuytinck Hybrid ZC","Nuytinck Hybrid ZC"
"Dřevo Tibhar Samsonov Alpha","Samsonov Alpha"
"Dřevo Tibhar Samsonov Force Pro","Samsonov Force Pro"
"Dřevo Tibhar Samsonov Pure Wood","Samsonov Pure Wood"
"Dřevo Tibhar Samsonov Stratus Carbon","Samsonov Stratus Carbon"
"Dřevo Tibhar Shang Kun Hybrid AC","Shang Kun Hybrid AC"
"Dřevo Tibhar Shang Kun Hybrid ZC","Shang Kun Hybrid ZC"
"Dřevo Tibhar Stratus Powerdefense","Stratus Powerdefense"
"Dřevo Tibhar Stratus Powerwood","Stratus Powerwood"
"Dřevo Tibhar VS Unlimited","VS Unlimited"
"Dřevo Yasaka Battle Balsa","Battle Balsa"
"Dřevo Yasaka Yasaka Extra 3D","Extra 3D"
"Dřevo Yasaka Yasaka Extra Offensive 7 Power","Extra Offensive 7 Power"
"Dřevo Yasaka Yasaka Falck Carbon","Falck Carbon"
"Dřevo Yasaka Yasaka Falck W7","Falck W7"
"Dřevo Yasaka Goiabao","Goiabao"
"Dřevo Yasaka Yasaka Ma Lin Carbon","Ma Lin Carbon"
"Dřevo Yasaka Ma Lin Extra Offensive","Ma Lin Extra Offensive"
"Dřevo Yasaka Yasaka Ma Lin Extra Special","Ma Lin Extra Special"
"Dřevo Yasaka Yasaka Ma Lin Soft Carbon","Ma Lin Soft Carbon"
"Dřevo Yasaka Sweden Classic","Sweden Classic"
"Dřevo Yasaka Yasaka Sweden Ek Carbon","Sweden Ek Carbon"
"Dřevo Yasaka Sweden Extra","Sweden Extra"
"potah Friendship Geospin","GeoSpin"
"ponožky Gewo Short Flex II","Short Flex II"
"ponožky Gewo Step Flex III","Step Flex III"
"ponožky Gewo GEWO Step Flex III","Step Flex III"
"kalhoty Gewo Mazara Ts18-4","Mazara TS18-4"
"tepláková souprava Gewo Vigo","Vigo"
"tréninkové kalhoty Gewo Vigo","Vigo"
"kalhoty Gewo Vigo","Vigo"
"tréninkový oblek Gewo Vigo","Vigo"
"bunda Gewo Tarent Ts18-1","Tarent TS18-1"
"tréninková bunda Gewo Vigo","Vigo"
"Potah Gewo Codexx EF Pro 54","Codexx EF Pro 54"
"Potah Gewo GEWO Codexx EF Pro 54","Codexx EF Pro 54"
"Potah Gewo Codexx EL Pro 52","Codexx EL Pro 52"
"Potah Gewo Codexx Pro 53 Superselect","Codexx Pro 53 SuperSelect"
"Potah Gewo Codexx Pro 55 Superselect","Codexx Pro 55 SuperSelect"
"Potah Gewo CS Powerspeed","CS Powerspeed"
"Potah Gewo GEWO CS Powerspeed","CS Powerspeed"
"Potah Gewo Inventus XT Pro 52.5","Inventus XT Pro 52.5"
"Potah Gewo Mega Flex Control","Mega Flex Control"
"Potah Gewo GEWO Mega Flex Control","Mega Flex Control"
"Potah Gewo Nano S/speed Control","Nano S/Speed Control"
"Potah Gewo GEWO Nano S/speed Control","Nano S/Speed Control"
"Potah Gewo Nexxus EL Pro 53 Hard","Nexxus EL Pro 53 Hard"
"Potah Gewo Nexxus EL Pro 53 Superselect","Nexxus EL Pro 53 SuperSelect"
"Potah Gewo Proton Neo 325","Proton Neo 325"
"Potah Gewo Proton Neo 375","Proton Neo 375"
"Potah Gewo Proton Neo 450","Proton Neo 450"
"Potah Gewo Proton Neo 475","Proton Neo 475"
"Potah Gewo GEWO Raver","Raver"
"Potah Gewo Raver","Raver"
"Potah Gewo Return Pro","Return Pro"
"Potah Gewo GEWO Return Pro","Return Pro"
"Potah Gewo Target Airtec FX","Target airTEC FX"
"Potah Gewo GEWO Target Airtec FX","Target airTEC FX"
"Potah Gewo Target Airtec L","Target airTEC L"
"Potah Gewo GEWO Target Airtec L","Target airTEC L"
"Potah Gewo Thunderball²","Thunderball²"
"Polokošile Gewo Anzio Poly","Anzio Poly"
"Polokošile Gewo Aurora II","Aurora II"
